Tweet,Category
HTC U12 duvar kağıtları,cnnturktekno
Türk Silahlı Kuvvetleri telefon üretmeye hazırlanıyor,cnnturktekno
Nokia X6 resmen tantıldı İşte fiyatı ve özellikleri,cnnturktekno
LG G7 vs Galaxy S9  En iyi arayüz kimde,cnnturktekno
Xiaomi yeni seriler ile bizleri karşılayabilir,cnnturktekno
 NES mini hangi oyunlar ile geliyor,cnnturktekno
En iyi pil süresine sahip akıllı telefon,cnnturktekno
Veri kaybı şirketleri iflasa götürüyor,cnnturktekno
Honor Türkiye fiyatı çıkış tarihi ve özellikleri,cnnturktekno
 Mayıs  Mustafa Kemal Atatürk ve arkadaşları Samsuna gitmek için Bandırma Vapuruna binip İstanbuldan yola çıktı …,cnnturktekno
Whatsapp bu sabah baştan aşağıya değişti İşte yeni hali,cnnturktekno
En net haliyle iPhone SE,cnnturktekno
Android Oreo alacak Samsung telefonlar,cnnturktekno
Galaxy A5 için Android Oreo ile gelen yenilikler,cnnturktekno
 Battlefield yakında geliyor,cnnturktekno
PTT Messenger yakında geliyor,cnnturktekno
Türkçe Siri davası sonuçlandı,cnnturktekno
 God of War fotoğraf modu ile eğlendiriyor,cnnturktekno
Honor Türkiye fiyatı çıkış tarihi ve özellikleri,cnnturktekno
Pil performansı ile dikkat çekiyor,cnnturktekno
Honor tanıtıldı,cnnturktekno
iPhone SE2 çıkış tarihi hakkında ilk detaylar,cnnturktekno
iOS Beta ile gelen yenilikler,cnnturktekno
Trump’tan çelişkili ZTE çıkışı,cnnturktekno
 Steam mobildeki ağırlığını artırıyor,cnnturktekno
Patlayan iPhone kameralara yakalandı,cnnturktekno
Petya virüsü nedir nasıl korunulur,cnnturktekno
 Days Gone için yeni oynanış videosu,cnnturktekno
OLED ekrandan vazgeçiyor mu,cnnturktekno
Kaçak telefon satışları artıyor,cnnturktekno
 God of War fotoğraf modu,cnnturktekno
Android Oreo alacak Samsung telefonlar,cnnturktekno
En net haliyle iPhone SE,cnnturktekno
 PUBG Mobile PC’den oynanabiliyor,cnnturktekno
 Ücretsiz The Flame in the Flood,cnnturktekno
 Battlefield geliyor,cnnturktekno
Galaxy Note test sonuçları üzdü,cnnturktekno
iPhone SE en net hali ile karşımızda,cnnturktekno
Bütçe dostu Galaxy J4 ve J6 NCC’de göründü,cnnturktekno
Yapay zeka hayatımıza hükmediyor,cnnturktekno
Android Oreo alacak Samsung telefonlar,cnnturktekno
 Red Dead Redemption nefes kesecek,cnnturktekno
Huawei P20 Pro vs Galaxy S9 kamera karşılaştırması,cnnturktekno
Avrupa’ya yeni bir Mi Store daha Peki ya Türkiye,cnnturktekno
İşte Nokia Xin özellikleri,cnnturktekno
Nokia Avrupa’da zirveye göz dikti,cnnturktekno
Zenfone özellikleri ve fiyatı,cnnturktekno
Galaxy A5 için Android Oreo ile gelen yenilikler,cnnturktekno
Android P güncellemesini alacak telefonlar,cnnturktekno
Play Store son sürüm yayınlandı,cnnturktekno
PES da dikkat çeken detay,cnnturktekno
HTC U12 modelinde de yüksekten uçacak,cnnturktekno
Android P için talep çok fazla,cnnturktekno
Galaxy Note tasarımı netleşti,cnnturktekno
PES da dikkat çeken detay,cnnturktekno
Zenfone özellikleri ve fiyatı,cnnturktekno
 FIFA da Şampiyonlar Ligi müjdesi,cnnturktekno
Selena Gomez Tarkan dinliyor,cnnturktekno
 Steam oyunları Steam Link ile mobilde,cnnturktekno
General Mobile GM GO incelemesi,cnnturktekno
 PES da dikkat çeken detay,cnnturktekno
YouTube iPhone Xte HDR video dönemini başlattı,cnnturktekno
Kirin  nm FinFet teknolojisiyle üretilecek,cnnturktekno
Türkçe dil desteğine mi kavuşuyor,cnnturktekno
Apple A12 yonga seti nasıl olacak,cnnturktekno
iOS ile iPhone kilidini kırmak zorlaşıyor,cnnturktekno
Gmail ile para göndermek çok kolay,cnnturktekno
İşte güncel Android kullanım oranı,cnnturktekno
 Anthem çıkış tarihi sonunda açıklandı,cnnturktekno
Anneler Günü için teknolojik hediye rehberi,cnnturktekno
Boston Dynamicsin Atlası ısınma koşusunda,cnnturktekno
Cep telefonlarındaki sesli asistanlarda büyük tehlike İnsanların duymayacağı komutları alabiliyorlar,cnnturktekno
Topluma el uzatan kadınlar teknolojiyle buluştu,cnnturktekno
Android Oreo güncellemesi alacak Samsung telefonlar,cnnturktekno
Galaxy J4 2018 özellikleri belli oldu,cnnturktekno
Your Phone ile telefonunuzu yönetin,cnnturktekno
iPhone X Plus iPhone Plus’a benzeyecek,cnnturktekno
Galaxy S8 Lite fark yaratabilecek mi,cnnturktekno
farklı renkteki OnePlus aynı karede görüntülendi,cnnturktekno
 PES lisanslı liglerle geliyor,cnnturktekno
Çentiksiz Nubia modeli geliyor,cnnturktekno
iPhone X Plus iPhone Plus’a benzeyecek,cnnturktekno
 MotoGP için PC’niz hazır mı,cnnturktekno
iOS uygulamaları için yeni zorunluluk,cnnturktekno
Android Oreo mayıs güncellemesi yayınlandı,cnnturktekno
Adım adım Android P Beta yükleme,cnnturktekno
WhatsApp çökme sorunu nasıl ortaya çıkıyor,cnnturktekno
kameralı iPhone ’da gelebilir,cnnturktekno
iOS Beta ile neler geliyor,cnnturktekno
 Bu hafta çıkacak oyunlar,cnnturktekno
Seçmen sorgulama uygulaması ile neler yapılabiliyor,cnnturktekno
Resmen duyuruldu İşte Android P Beta ile gelen yenilikler,cnnturktekno
 PES resmen duyuruldu İşte fiyatı ve tanıtım videosu,cnnturktekno
Darüşşafaka Lisesi robotik ekibine ABDden büyük ödül,cnnturktekno
Karşınızda LG G7,cnnturktekno
 Red Dead Redemption görselleri nefes kesiyor,cnnturktekno
Google IO ’de neler tanıtılacak,cnnturktekno
 The Witcher komple değişiyor,cnnturktekno
Galaxy Note Benchmark testinden kaç puan aldı,cnnturktekno
iOS ile iPad’ler coşacak,cnnturktekno
 The Last of Us emülatör ile PC’ye geliyor,cnnturktekno
iPhone X ve iPhone Plus da davalık oldu,cnnturktekno
 PES hakkında önemli detaylar,cnnturktekno
Galaxy Note özellikleri sızdırıldı,cnnturktekno
Akıllı cihaz tasarlayıp Türkiye birincisi oldular,cnnturktekno
Galaxy S10 nasıl olacak,cnnturktekno
OnePlus modelinin özellikleri kesinleşti,cnnturktekno
 Xbox Game Pass üyelik fiyatı artıyor,cnnturktekno
HTC U12 ve ilginç özellikleri,cnnturktekno
 God of War üç günde rekor kırdı,cnnturktekno
iPhone mikrofon sorunu yaşıyor,cnnturktekno
Galaxy Note ile yeni bir devir başlıyor,cnnturktekno
Futbolun geleceği yapay zeka ile tanımlanacak,cnnturktekno
 Sanal gerçeklik gözlüğü ile fobilere son,cnnturktekno
Cambridge Analytica kepenkleri indiriyor,cnnturktekno
Apple mm jak adaptörünü de rafa kaldırıyor,cnnturktekno
Galaxy A6 fiyatı ile öne çıkacak,cnnturktekno
Galaxy Tab S4ün dikkat çeken özellikleri,cnnturktekno
WhatsApp grup video görüşme nasıl çalışacak,cnnturktekno
 PlayStation sahipleri bu habere üzülecek,cnnturktekno
Autodesk Sketchbook ücretsiz oldu,cnnturktekno
 PUBG Mayıs güncellemesi ile gelen yenilikler,cnnturktekno
Instagram paralı mı olacak,cnnturktekno
Apple Watch yine bir hayat kurtardı,cnnturktekno
 Shadow of the Tomb Raider en iyisi olacak,cnnturktekno
LG G7 vs iPhone X,cnnturktekno
 PUBG oyuncusu can aldı,cnnturktekno
Huawei P20 Pro vs Galaxy S9 kamera karşılaştırması,cnnturktekno
Twitter şifrenizi değiştirdiniz mi,cnnturktekno
Samsung şeffaf ekranlı katlanabilir akıllı telefon tanıtacak,cnnturktekno
Turkcell milyonlarca kişiye bu SMSi attı Herkes merak ediyor Kriz SMSC nedir,cnnturktekno
Twitterdan milyon kullanıcısına uyarı Şifrelerinizi değiştirin,cnnturktekno
O programlara dikkat Profilinize bakanı öğreneyim derken verilerinizi çaldırmayın,cnnturktekno
Sevgilisi olmayanlara güzel haber Facebook imdada yetişecek,cnnturktekno
İşte en yüksek maaşı veren teknoloji şirketleri,cnnturktekno
İnternette dolaşan tamamen sahte fotoğraf,cnnturktekno
Kişisel verileri izinsiz toplayan o şirket kapanıyor,cnnturktekno
Sevgilisi olmayanlara güzel haber Facebook imdada yetişecek,cnnturktekno
Dünyanın en popüler mesajlaşma uygulaması yasaklandı halk sokağa döküldü,cnnturktekno
Kahramanmaraş Uluslararası Robot Turnuvası robot kıyasıya yarıştı,cnnturktekno
İnternette dolaşan tamamen sahte fotoğraf,cnnturktekno
İşte en yüksek maaşı veren teknoloji şirketleri,cnnturktekno
Galakside bir ilk Benzersiz deneyim geceliği milyon dolar,cnnturktekno
Rekor YouTube’da milyar izlenmeye ulaştı,cnnturktekno
Bir veri skandalı daha Çocukların verilerini izinsiz izlemişler,cnnturktekno
ABden Facebook ve Twittera kritik çağrı,cnnturktekno
Facebooktan yüz tanıma teknolojisi,cnnturktekno
Dünyanın en büyük yapay zeka sergisi Türkler tarafından Paris’te yapıldı,cnnturktekno
Instagram hikayelerinde sevindiren özellik,cnnturktekno
Üniversite öğrencileri yüzde yüz elektrikle çalışan otomobil üretti,cnnturktekno
Instagram hikayelerinde sevindiren özellik,cnnturktekno
WhatsAppe yaş sınırı geliyor,cnnturktekno
Whatsappta yeni özellik Grup konuşmalarında artık,cnnturktekno
Facebooktan yüz tanıma teknolojisi,cnnturktekno
Türkiyede ilk kez yaşandı Bitcoin üreten cihazlar yangın çıkardı,cnnturktekno
Bir veri skandalı daha Çocukların verilerini izinsiz izlemişler,cnnturktekno
Elon Musk’un şirketi SpaceX tarih verdi saatlik yolculuk dakikaya inecek,cnnturktekno
Gmail kullanıcıları dikkat Tamamen değişiyor,cnnturktekno
 Zuckerberg ifade verdi Rusların bilgi operasyonlarını tanımlamakta yavaştık,cnnturktekno
Ünlü dizinin karakterleriyle saldırdılar YouTube hacklendi Birçok ünlü video silindi,cnnturktekno
Lise öğrencilerinden insansız kara aracı Porsuk,cnnturktekno
iPhonelarda yeni dönem Appleın son bombası böyle olacak,cnnturktekno
 Çocukları sanal dünyada korumada ailelere yol gösterecek rehber Kapat,cnnturktekno
 Aydın Doğan Doğan Medyaya veda etti,cnnturktekno
 Biz sizi çok sevdik,cnnturktekno
 Telefonunuza SMS yağmuru bugünden itibaren sona eriyor,cnnturktekno
Rekor YouTube’da milyar izlenmeye ulaştı…,cnnturktekno
Galakside bir ilk Benzersiz deneyim geceliği milyon dolar,cnnturktekno
Dünyada milyon kişinin etkilendiği Facebook skandalında Türkiyeden kaç kişi etkilendi,cnnturktekno
 Facebooktan itiraf milyon kullanıcının verileri usulsüz kullanıldı,cnnturktekno
’de Appleın katlanabilir iPhone’u mu geliyor,cnnturktekno
İşte en yüksek maaşı veren teknoloji şirketleri,cnnturktekno
 Üç tekerlek kullanan uygun fiyatlı elektrikli otomobil,cnnturktekno
 Yılmaz Türkiye teknolojiyi öğrenmeli,cnnturktekno
 Youtube çalışanları haberi hızla duyurdu,cnnturktekno
AnTuTu performans testinde görüldü,cnnturktekno
İnternette dolaşan tamamen sahte fotoğraf,cnnturktekno
KTÜ hidrojen ve elektrikle çalışan hibrit araç üretti Yavuz SS,cnnturktekno
 Ünlü bilim insanları nükleer santral kamu spotunda bir araya geldi,cnnturktekno
Samsung o telefonların fişini çekti artık güncelleme yok,cnnturktekno
 Uzay istasyonu Pasifike düştü,cnnturktekno
 ByLockun ardından Falcon da çözüldü,cnnturktekno
Facebook skandalında gizli yazışma sızdı,cnnturktekno
 Elon Musk iflasın eşiğinde,cnnturktekno
Milyonlarca kullanıcının beklediği güncelleme iOS yayınlandı Yeni özellikler ne Hangi telefonlara yüklenebil…,cnnturktekno
MP’lik sensöre veda,cnnturktekno
Facebook’ta yeni dönem O program artık yok,cnnturktekno
Ünlü markanın yeni telefonunun tanıtımında Türk lirası ve Atatürk sürprizi,cnnturktekno
Atacama Çölünde bulunan uzaylı iskeletinin sırrı çözüldü,cnnturktekno
Neredeyse bir çılgınlığa dönen GetContactın arkasından bir Türk çıktı,cnnturktekno
Neredeyse bir çılgınlığa dönen GetContactın arkasından bir Türk çıktı,cnnturktekno
BTK o uygulamalar için harekete geçiyor GetContact şüpheliler arasında,cnnturktekno
Ünlü markanın yeni telefonunun tanıtımında Türk lirası ve Atatürk sürprizi,cnnturktekno
Ekranları hareketlendirecek satın alma Google aramaları değişiyor,cnnturktekno
 İsveçli üretici Cakein ilk motosikleti olan Kalk devrim niteliğinde ►,cnnturktekno
Qualcomm’un ultrasonik sensörü Mate ’le gelebilir mi,cnnturktekno
Meizu M5 Note inceleme altında,cnnturktekno
MP’lik sensöre veda,cnnturktekno
Facebookun yeni numarası BFF,cnnturktekno
’de Appleın katlanabilir iPhone’u mu geliyor,cnnturktekno
Atacama Çölünde bulunan uzaylı iskeletinin sırrı çözüldü,cnnturktekno
GetContact tehlikeli mi Verdiğiniz izinlere dikkat,cnnturktekno
Bu kaza önlenebilir miydi,cnnturktekno
 Android TVlerde hacker saldırılarından kurtulmak için ne yapmalı,cnnturktekno
OnePlus da çentikli telefonlar arasına dahil oluyor,cnnturktekno
 Beyaz Şapkalı genç hackerlar siber güvenliği sağlamak için yarıştı,cnnturktekno
 Lastik basıncınızı bluetooth cihazla telefonunuzdan anında öğrenin,cnnturktekno
Instagram açıkladı Eski haline dönüyor,cnnturktekno
Facebook’a darbe üstüne darbe… Teker teker siliyorlar,cnnturktekno
milyon kişinin verilerinin usulsüz kullanımı konusunda Zuckerberg ilk defa konuştu Size hizmet etmeyi hak etmiy…,cnnturktekno
Güney Koreden Facebooka para cezası,cnnturktekno
Facebook’a şok üstüne şok Gizli kamera görüntüleri ortaya çıktı,cnnturktekno
Facebooku silin kampanyasına WhatsApptan destek,cnnturktekno
 Beklenen dizi bu aksam 0’de ’de,cnnturktekno
 Yapay zeka tartışmaları artarken robot teknolojisi de ilerlemeye devam ediyor İşte bu teknolojinin son ürünlerinden biri da…,cnnturktekno
 Güncel teknoloji ve sosyal medya haberleri ile yazılım donanım bilişim teknolojileri konularında güncel haberler için C…,cnnturktekno
Güncel teknoloji ve sosyal medya haberleri ile yazılım donanım bilişim teknolojileri konularında güncel haberler…,cnnturktekno
Android Auto’ya beklenen değişiklik,cnnturktekno
Şimdiye kadarki en pahalı Samsung telefon,cnnturktekno
Instagram hikayenize bakanlarda en tepede yer alanlar profilinize gizli gizli bakanlar mı İşin sırrı çözüldü…,cnnturktekno
Facebook hisseleri dibe vurdu,cnnturktekno
 Milli Eğitim Bakanlığı okuma yazma seferberliği için teknolojiyi devreye soktu,cnnturktekno
 Mart Çanakkale Zaferinin  yıl dönümünde Mustafa Kemal Atatürk ve şehitlerimizi saygıyla anıyoruz …,cnnturktekno
 Mart Çanakkale Zaferinin  yıl dönümünde şehitlerimizi saygıyla anıyoruz,cnnturktekno
 Mart Çanakkale Zaferinin  yıl dönümünde şehitlerimizi saygıyla anıyoruz,cnnturktekno
 Atatürk Havalimanında kaçak geçişlere yeni önlem ►,cnnturktekno
 Uzayda gün geçirerek rekor kırmıştı ABDli astronotun DNAsı da değişti,cnnturktekno
 Türk teknoloji şirketi ABDli yatırımcıların radarına girdi,cnnturktekno
TÜİK rakamları açıkladı Türkiyede internete erişim oranı yüzde i geçti,cnnturktekno
 Konuşabilmek için Dronea telefon bağlıyorlardı ►,cnnturktekno
 Elon Musk tarih verdi Mars uçuşları başlıyor,cnnturktekno
WhatsApp pişmanlığın süresini saat dakika saniyeye çıkaracak,cnnturktekno
 Bahçelinin tepki gösterdiği robot cevap verdi Yeterince cesursa,cnnturktekno
 WhatsApp pişmanlığın süresini saat dakika saniyeye çıkaracak,cnnturktekno
WhatsApp pişmanlığın süresini saat dakika saniyeye çıkaracak,cnnturktekno
Pişmanlığın süresi saat dakika saniye,cnnturktekno
 Filli Boya’dan yine sosyal medyayı sallayan Mart reklamı,cnnturktekno
Snapchatte kullanılıyordu O özellik Instagrama da geliyor,cnnturktekno
 Uçan otomobil görücüye çıktı,cnnturktekno
Pişmanlığın süresi dakikadan saat dakika saniyeye çıkıyor,cnnturktekno
Facebooktan skandal anket Çocuktan cinsel fotoğraf istenmeli mi,cnnturktekno
Atık mayonezlerden biyodizel ürettiler,cnnturktekno
 Askeri operasyonlar için üretilen keşif robotu,cnnturktekno
Turnuva çok çekişmeli Lise öğrencileri haftada robot yapacaklar,cnnturktekno
 Kasasız alışveriş artık Türkiyede de var,cnnturktekno
 Türk sanatçılardan Washingtonda fütüristik bir sergi Paralel Evren,cnnturktekno
Kredi kartı büyüklüğünde akıllı telefon,cnnturktekno
Facebook sansür nedeniyle özür diledi,cnnturktekno
Appleın eş kurucusunun Bitcoinleri çalındı,cnnturktekno
Grup mesajını sık kullananlar dikkat WhatsAppa yeni özellikler geliyor,cnnturktekno
 Roberto Carlosun o golünü fizikçiler araştırdı,cnnturktekno
 Twitterdan çok beklenen yeni özellik ile ilgili açıklama Nasıl çalışıyor,cnnturktekno
 Yıllardır beklenen geldi Twitterda yeni uygulama bu alanı sizden başkası göremeyecek,cnnturktekno
Üç yeni iPhone X geliyor Biri bu güne kadar gördüğünüz en pahalı ve en büyük iPhone olacak,cnnturktekno
eria XZ2 Compact kaçtan satılacak,cnnturktekno
 Mehmetçik için kanama durduran sargı bezi ürettiler,cnnturktekno
 Herkes onun için ağladı bir tek sahibi güldü,cnnturktekno
 Herkes onun için ağladı bir tek sahibi güldü Kedinin öldü denilen sahibi konuştu,cnnturktekno
 Dronelar podyuma çıkıp çanta sergiledi,cnnturktekno
Nokia dan sonra bir başka efsane telefonu daha piyasaya sürdü,cnnturktekno
Nokia Matrix telefonu olarak da bilinen bir efsaneyi daha yeniden piyasaya sürüyor,cnnturktekno
Nokia Matrix telefonu olarak da bilinen bir efsaneyi daha yeniden piyasaya sürüyor,cnnturktekno
Nokianın MWC ’de tanıttığı için tanıtım videosu,cnnturktekno
Vestel Venus Z20yi Barcelonada tanıttı,cnnturktekno
Yapay zeka modern savaşın yeni silahı,cnnturktekno
Nokia MWC ’de ufak çaplı bir şov yaptı,cnnturktekno
Galaxy S9 vs Nokia Sirocco,cnnturktekno
Samsung Galaxy S9a hiç bu açıdan bakılmadı,cnnturktekno
İşte Samsung Galaxy S9un en çok dikkat çeken özelliği,cnnturktekno
Samsung Galaxy S9a hiç bu açıdan bakılmadı Önceki modele göre değişen ne hangi özellikte iddialı Aradığınız c…,cnnturktekno
Merakla bekleniyordu Fiyatı belli oldu,cnnturktekno
Samsung Galaxy S9 ve Galaxy S9 Plusı tanıttı Fiyatı ve çıkış tarihi,cnnturktekno
Huawei Arabia Samsungun o videosunu bu videoyla trolledi,cnnturktekno
Samsung bugünü işaret ederek bu videoyu yayınlamıştı,cnnturktekno
Samsung Galaxy S9 ve S9 Plusın resmi videosunu yayınladı,cnnturktekno
Galaxy S9 için çok beklemeyeceğiz,cnnturktekno
Galaxy S9 Avrupa fiyatı iPhone X’ten ucuz,cnnturktekno
 Üniversiteli genç okuduğu okulun sahibiyle ortak oldu,cnnturktekno
 Elon Musktan bir roket daha ►,cnnturktekno
 Geleceğin teknolojileri Fuarİzmirde,cnnturktekno
VMware teknolojisini bulutta da kullanın,cnnturktekno
YouTube TSK’nın videosunu kaldırdı,cnnturktekno
Airbus elektrikli uçan taksinin görüntülerini yayınladı,cnnturktekno
 Bir gün değil bir yıl değil tam yıldır bu atölyede zanaatla uğraşıyor Nihat Usta İstanbulda annem beni bir Ermeni us…,cnnturktekno
Nokia un tasarıma S9’u andırabilir,cnnturktekno
Galaxy S9 ve S9’ın fotoğrafları sızdırıldı,cnnturktekno
Steame KDV geldi,cnnturktekno
yaşındaki Yiğit Can Appleın teşekkür listesinde,cnnturktekno
 Kalori gerçekten yanar mı,cnnturktekno
 Kendi evinizde geri dönüşüm yapmak ister misiniz,cnnturktekno
 Dünyanın en akıllı bastonu Türk mühendisler geliştirdi,cnnturktekno
 Evde kendi jiroskopumuzu nasıl yapabiliriz,cnnturktekno
Black Mirror dizisi gerçek oluyor,cnnturktekno
Dünyada bir ilk Uçak koltukları çift kişilik yatak oldu,cnnturktekno
 Elektronik atıklar ağaca dönüşüyor,cnnturktekno
 Görme engelli sanatçının oluşturduğu büyüleyici GIF’ler,cnnturktekno
Bitcoin çok yakıyor,cnnturktekno
 Daha özgüvenli bir gençlik için Dove Özgüven Projesi kapsamında Dr Özgür Bolat CNN TÜRK Facebook Canlı yayınında sorularınızı…,cnnturktekno
Sony Twitter’dan Açıkladı,cnnturktekno
Google Pixel güncellemesi hatalarla dolu,cnnturktekno
 İçinde otomobil garajı olan milyon TLlik yat ►,cnnturktekno
Telefonunuzda bunu görürseniz sakın açmayın,cnnturktekno
 Daha özgüvenli bir gençlik için Dove Özgüven Projesi kapsamında Dr Özgür Bolat Facebook Canlı yayınında sorularınızı y…,cnnturktekno
G teknolojisi için dev işbirliği anlaşması,cnnturktekno
 Trump Uluslararası Uzay İstasyonunu özelleştiriyor,cnnturktekno
 Dünyanın en centilmen robotu,cnnturktekno
 Türkiyenin dijital radyo platformu radyonom ile canlı radyo dinlemekten fazlasına sahip olun …,cnnturktekno
Elon Muskın Marsı ıskalayan otomobiline yıl içinde bakın ne olacak,cnnturktekno
 Kış Olimpiyatları için hazırladığımız dergimizi takip etmek için,cnnturktekno
 Biri bu çılgını durdursun Muskın hedefinde şimdi ne var,cnnturktekno
Kamuflaj uzmanı olan görünmez kuş olarak da bilinen çöl çobanaldatanı yıllar sonra ortaya çıktı…,cnnturktekno
 Kış Olimpiyatları için hazırladığımız dergimizi takip etmek için,cnnturktekno
 Samsung Galaxy A8 2018 inceleme videosu ►,cnnturktekno
 Tünel temizleme işlemi artık bu kamyonla yapılabiliyor ►,cnnturktekno
 İnsan tarafından kontrol edilen bin poundluk ekeleton,cnnturktekno
WhatsApp kullanıcılarını heyecanlandıran yenilik,cnnturktekno
 Elon Muskın Teslası Marsı ıskalayacak,cnnturktekno
Bilim insanlarından büyük keşif Aynı anda hem katı hem de sıvı halde bulunuyor,cnnturktekno
Spotify Türkiye ofisini kapatıyor,cnnturktekno
 10 yıl içinde sokakta kendi kendine konuşan  daha çok insan göreceğiz  için yazdı http…,cnnturktekno
 Bakan Arslanı kızdıran robot özür diledi,cnnturktekno
Televizyon takibinde yapay zeka dönemi,cnnturktekno
Appledan yavaşlayan iPhonelar için indirim adımı,cnnturktekno
 O robot Bakandan özür diledi,cnnturktekno
 Dünyanın en güçlü roketi Falcon Heavy uzaya fırlatıldı İşte o yolculuktan film karesi gibi görüntüler,cnnturktekno
 Falcon Heavy uzaya böyle fırlatıldı,cnnturktekno
TRAPPIST1 gezegenlerinin bazılarında bol miktarda su olabilir,cnnturktekno
 Salep orkidesi sadece ayda üretilebilecek,cnnturktekno
 Elektronik sigara Avrupanın da gündeminde,cnnturktekno
İşte Yerli Whatsapp PTT Messenger hakkında bilinmeyenler,cnnturktekno
 Yüzde yüz yerli ve yeni bir yazılım ►,cnnturktekno
Elon Musktan yeni bir çılgınlık daha Kendi tanıttığı otomobili roketle,cnnturktekno
Bekir Bozdağ açıkladı İşte yerli Whatsappın özellikleri,cnnturktekno
 🇹🇷 Türkiyede dijital radyoculukta ilkleri hayata geçiren şimdi de radyo ile karşında …,cnnturktekno
 Tesla ve SpaceX girişimlerinin baş aktörü olan Elon Musk milyar dolarlık servetini nasıl değerlendiriyor İşte detaylar…,cnnturktekno
Beklenen özellik nihayet YouTubea da geldi,cnnturktekno
Son güncellemeyle Instagrama yeni özellik geldi,cnnturktekno
 Rahmi Koç Müzesindeki Bilin Deneyin mutfağına giren Arda Türkmen Asude Altıntaş ve Cihan Özalevli ile kivinin DNAsını çıkar…,cnnturktekno
 aramızdan ayrılalı yıl geçti,cnnturktekno
Bir Nokia efsanesi daha geri dönüyor,cnnturktekno
 Bu otele girdiğinizde terlikler kendi kendilerine hareket edip ayağınıza geliyor minderler masalar yine kendiliğinden düzene…,cnnturktekno
Mobil tanışma uygulamas Happn’ın Türkiye’deki üye sayısı belli oldu,cnnturktekno
Facebook ve Instagramdan yeni karar Tamamen yasaklandı,cnnturktekno
Beklenen özellik nihayet YouTubea da geldi ama,cnnturktekno
Elon Musk yeni oyuncağını tanıttı binlerce sipariş aldı Zombi istilasına karşı alev makinesi…,cnnturktekno
Elon Musk yeni oyuncağını tanıttı binlerce sipariş aldı Zombi istilasına karşı alev makinesi…,cnnturktekno
Apple iOS sürümü açıklandı Eski telefonlar hızlandıracak mı İşte iPhonelara gelecek yeni özellikler…,cnnturktekno
Son teknolojik icat Diyetisyen koltuk,cnnturktekno
Galaxy S9 ve S9 Plus tarihte bir ilk olacak Samsung bunu daha önce yapmadı,cnnturktekno
Samsung iki yeni telefonu tanıttı Türkiye fiyatları da açıklandı,cnnturktekno
Apple iOS sürümü ne zaman yayınlanıyor Eski telefonlar hızlandıracak mı İşte iPhonelara gelecek yeni özelli…,cnnturktekno
Gelecekte hangi mobil teknolojileri göreceğiz,cnnturktekno
Dünyanın en sinir bozucu bilgisayar oyunu,cnnturktekno
NASA denemelere başladı Güneşin zaptı yakın,cnnturktekno
Dünyanın ilk kasasız ve kasiyersiz süpermarketi açıldı,cnnturktekno
Facebook geliştirdi İşte yeni zaman birimi,cnnturktekno
Dünyanın ilk kasasız ve kasiyersiz süpermarketi açıldı,cnnturktekno
Dikkat telefondan sesinizi gizli gizli dinliyor,cnnturktekno
Logitechi de neler bekliyor Mustafa Uyar anlattı,cnnturktekno
Cisconun CES standında öne çıkanlar,cnnturktekno
BrainCo ile zihninizi farklı bir şekilde kullanın,cnnturktekno
Vestel Smart Home Ready TV ön inceleme videosu,cnnturktekno
Akıllı yatak ile deliksiz bir uyku mümkün,cnnturktekno
Foldimate ile çamaşır katlamak çok kolay,cnnturktekno
iPhone X üretimi durduruluyor,cnnturktekno
Devrim gibi değişiklik Bundan böyle Instagrama girdiğinizi herkes görecek,cnnturktekno
Espor başarısı burs kazandırıyor,cnnturktekno
Dikkat Bu mesaj iPhoneları çökertiyor,cnnturktekno
Google erişim engeline rağmen Çin’de üçüncü ofisini de açtı,cnnturktekno
Google nin en iyi indie oyunları için adayları belirledi,cnnturktekno
CES ’e damga vuran ürünler,cnnturktekno
Akıllı hoparlör kullanımı artıyor,cnnturktekno
te kurulan teknoloji şirketi,cnnturktekno
Vestel Smart Home Ready TVye yakından bakıyoruz,cnnturktekno
Google Zürih Ofisinden istifayı düşündüren fotoğraflar,cnnturktekno
Cisco ve Hyundai ortak çalışacak,cnnturktekno
te kurulan teknoloji şirketi,cnnturktekno
Beyaz adamın ölüm getirdiği ispatlandı milyon kişinin ölümüne neden oldular,cnnturktekno
Google Zürih Ofisinden istifanın eşiğine getirten kareler,cnnturktekno
