Tweet,Category
 The Division nin fiyatı yüksek geldi,cnnturktekno
Windows tekrardan hayat buldu,cnnturktekno
HTC U12 Life resmiyet kazandı,cnnturktekno
Android Pie ile geleceği kesinleşti,cnnturktekno
Note ’un nasıl üretildiğine tanıklık edin,cnnturktekno
 Call of Cthulhu için özel bir video yayınlandı,cnnturktekno
Oppo R17 Pro resmen tanıtıldı,cnnturktekno
ZTE An Pro’nun yeni görüntüleri sızdırıldı,cnnturktekno
 Assassins Creed bir müddet inzivaya çekilebilir,cnnturktekno
Daha tanıtılmadan karaborsa üzerinden satışa sunuldu,cnnturktekno
Mobil oyuncular için en güçlü akıllı telefonlar,cnnturktekno
Bu telefon ağırlığıyla dikkat çekiyor,cnnturktekno
En iyi iPhone uygulamaları,cnnturktekno
Google Street Viewde yapılan cinayet şakası,cnnturktekno
Einstein  Newton  Einsteinın teorisi kara delik testini geçti,cnnturktekno
FIFA un fiyatı cep yakacak,cnnturktekno
V11 Pro Amazon Hindistan’da görüldü,cnnturktekno
Whatsapp kullanıcılarını bekleyen tehlike Sadece bir marka etkilenmeyecek,cnnturktekno
Alman uzmanlar ölçtü İşte en fazla radyasyon yayan akıllı telefonlar,cnnturktekno
iPhone modellerinin satış beklentisi,cnnturktekno
iPhone SE’nin halefi olabilir,cnnturktekno
 Fortnite V530 ile gelen yenilikler,cnnturktekno
 For Honor kısa bir süreliğine ücretsiz oldu,cnnturktekno
Note soğutma sistemi nasıl çalışıyor,cnnturktekno
Gelmiş geçmiş en çok indirilen mobil uygulamalar,cnnturktekno
X23 resmi bir videoda ortaya çıktı,cnnturktekno
ZTE An Pro’nun yeni görüntüleri sızdırıldı,cnnturktekno
Honor X kullanım halinde görüldü,cnnturktekno
Facebook bir uygulamayı platformdan çıkardı,cnnturktekno
En az farklı gizemli tür bulundu milyon yıl yaşında,cnnturktekno
Facebook ve Twitter o hesapları siliyor,cnnturktekno
Akıllı olmayan cep telefonları moda oldu,cnnturktekno
Google çalışanları yönetimden şeffaflık istedi,cnnturktekno
Işığa göre renk değiştirebilen telefon,cnnturktekno
Yeni iPhone’ların fiyatları ne kadar olacak,cnnturktekno
Huawei Mate Lite hakkında yeni detaylar ortaya çıktı,cnnturktekno
Display Matee göre en iyi ekrana sahip olan telefon,cnnturktekno
Teknolojinin gelişmesi ile birlikte robotlar yaşamın her anında yanıbaşımızda,cnnturktekno
Gelişen teknoloji ile birlikte robotlar artık her yerde işte birbirinden yetenekli yaptıklarına inanması güç robo…,cnnturktekno
Bu uygulamanın her telefonda olması lazım bir kaç saniye ile binlerce hayat kurtarabilir,cnnturktekno
iOS nin en dikkat çeken özelliği bu modellerde çalışmayacak,cnnturktekno
İnternette sextortion şantajı,cnnturktekno
NASAnın Güneşe yolculuğu başladı,cnnturktekno
Tarihin en tuhaf android telefonları,cnnturktekno
Samsung Note ile görücüye çıktı,cnnturktekno
Samsung Türkiye Note fiyatı özellikleri ve Türkiye çıkış tarihini açıkladı,cnnturktekno
 Iron Man uçuş kostümü gerçek hayata taşındı,cnnturktekno
 Apple Watch için iki yeni yüzme antrenmanı uygulaması,cnnturktekno
Apple Watch için iki yeni yüzme antrenmanı uygulaması,cnnturktekno
İşte tüm zamanların en çok satan cep telefonu,cnnturktekno
Rusyadaki gök taşında bilinmeyen bir mineral bulundu Güney Rusyada bulunan ve altın sanıl…,cnnturktekno
Aya düşen iki gök taşı görüntülendi,cnnturktekno
Türk mühendisler geliştirdi dakikada şarj olan elektrikli otobüs,cnnturktekno
Uzayda rekabet kızışıyor,cnnturktekno
Güneşe dokunacak NASAnın Güneşe yolculuğu önümüzdeki hafta gerçekleşecek,cnnturktekno
İşte mavi elmasların sırrı Nadir bulunan mavi elmaslarla ilgili merak edilen sorunun yanıt…,cnnturktekno
İşte dünyanın en küçük cep telefonu,cnnturktekno
İşte Dünyaya en çok benzeyen gezegen,cnnturktekno
Whatsappta mesaj başına para ödeme dönemi başladı,cnnturktekno
 Çocuğumun itibarı söz konusu Çocuğu Fortniteta başarılı olsun diye günde sterlin ödüyor htt…,cnnturktekno
 Ebeveyn olmak hiç de kolay değil Çocuğu Fortniteta başarılı olsun itibarını kaybetmesin diye günde sterlin ödüyor…,cnnturktekno
Whatsappta mesaj başına para ödeme dönemi başladı,cnnturktekno
Dikkat Facebook ve Instagrama zaman sınırlaması geldi,cnnturktekno
Uzaya gidecek astronotlar canlı yayında belirlenecek,cnnturktekno
Ünlü site hacklendi kullanıcı bilgileri ele geçirildi,cnnturktekno
 Yapay zeka destekli akıllı satranç tahtası,cnnturktekno
 Araba görünümlü bisiklet PodRide,cnnturktekno
WhatsAppın yeni grup arama özelliği devreye girdi,cnnturktekno
 PES dan Türkiye Süper Ligi müjdesi,cnnturktekno
Bu kulaklıklar bir servet,cnnturktekno
İşe iPhone ve iPhone X Plus,cnnturktekno
Hızlı uzayan saçlarıyla Instagramı sallayan aylık Japon bebek,cnnturktekno
AK47 dışındaki şaşırtıcı Kalaşnikof ürünleri,cnnturktekno
AK47 dışındaki şaşırtıcı Kalaşnikof ürünleri,cnnturktekno
Tam bin yıl önce donmuştu Uzmanlar sayesinde hayata kaldığı yerden devam etti,cnnturktekno
Einstein  Newton  Einsteinın teorisi kara delik testini geçti,cnnturktekno
NASA ödüllü kardeşler Londra yolunda,cnnturktekno
Google Youtubeu bilerek yavaşlatıyor mu,cnnturktekno
Yüzyılın en uzun kanlı ay tutulması yarın gerçekleşecek Mars Jüpiter ve Satürn ortaya çıkacak…,cnnturktekno
milyon yıllık dinozor fosili gün ışığına çıktı,cnnturktekno
AB dünya yörüngesine uydu fırlattı,cnnturktekno
Facebook hem kullanıcı sayısını hem karını arttırmaya devam ediyor,cnnturktekno
Marsta göl bulundu,cnnturktekno
5 milyon yıllık fosiller gün yüzüne çıkacak,cnnturktekno
 Lastik basıncınızı bluetooth cihazla telefonunuzdan anında öğrenin ►,cnnturktekno
 Güneş enerjisiyle güçlendirilen dev tekne ►,cnnturktekno
 Bu esnek mobilyalar alan tasarrufu açısından çok ideal ►,cnnturktekno
 Programlanabilir yüksek manevra kabiliyetine sahip robot ►,cnnturktekno
 boyutlu yazıcı ile düşük maliyetli barınma çözümü ►,cnnturktekno
 Günlük hayatı kolaylaştıran D protezler ►,cnnturktekno
 Dünyanın en fütüristik kütüphanesi Çinde açıldı ►,cnnturktekno
 Dev treylerleri park eden küçük robot ►,cnnturktekno
Bakan Cahit Turhandan G çağrısı ►,cnnturktekno
Uzay yolculuğuna adını kazıyan kadın,cnnturktekno
ABDde isteyen boyutlu yazıcı ile silah yapabilecek,cnnturktekno
İşte en çok arızalanan akıllı telefonlar,cnnturktekno
Google CEOsundan milyar euroluk açıklama,cnnturktekno
Netflixin abone sayısı milyonu aştı,cnnturktekno
milyon tonluk buz dağı her geçen gün köye yaklaşıyor,cnnturktekno
 Monster Hunter World PC sistem gereksinimleri,cnnturktekno
 Darksiders çıkış tarihi netleşti,cnnturktekno
Bilim dünyasında büyük keşif milyar ışık yılı uzaktan dünyaya gelen kozmik parçacık tespit edildi…,cnnturktekno
Amiral gemilerin özellikleri karşı karşıya,cnnturktekno
iPhone fiyatları zamlandı,cnnturktekno
İşte Appleın sonbaharda tanıtacağı yeni iPhonelar,cnnturktekno
Yol tutmasına karşı gözlük üretildi,cnnturktekno
WhatsAppta bu kelimeyi sakın yazmayın,cnnturktekno
Apple Intel ile devam edecek,cnnturktekno
 Pokemon Go hala para basıyor,cnnturktekno
Xiaomi’de işler yolunda gitmiyor,cnnturktekno
 iOS ve Android için en iyi dövüş oyunları,cnnturktekno
Airbus uzaya çıkacak,cnnturktekno
 Gran Turismo Sport için yeni bir pist geliyor,cnnturktekno
 F1 fazlasıyla gerçekçi olacak,cnnturktekno
Xiaomi Mi Mix nasıl olacak,cnnturktekno
Bu özellik iPhone Xte bile yok,cnnturktekno
Yeni iPhone yeni renkler ile geliyor,cnnturktekno
En iyi Cosplay çalışmaları,cnnturktekno
 Pro Evolution Soccer sadece TL,cnnturktekno
Xiaomi tekrardan ABD yolunda,cnnturktekno
 PlayStation çıkış tarihi sızdı,cnnturktekno
SPen fark yaratabilecek mi,cnnturktekno
in en iyi iPhone uygulamaları,cnnturktekno
 Rockstar’dan GTA çıkış tarihi açıklaması,cnnturktekno
 NBA K19 ön sipariş fiyatıyla cep yakıyor,cnnturktekno
HTC U12 dayanıklılık testine tabii tutuldu,cnnturktekno
Yeni Vivo V9 GB RAM’le geliyor,cnnturktekno
 Asphalt  Legends geliyor,cnnturktekno
Android P Beta nasıl yüklenir,cnnturktekno
 Yeni Call of Duty hikaye modu ile gelebilir,cnnturktekno
 Surface Phone ile oyuna geri dönüyor,cnnturktekno
Yeni Surface Phone tasarımıyla fark yaratıyor,cnnturktekno
Honor GT arttırılmış performansıyla dikkat çekiyor,cnnturktekno
 PlayStation Plus’ta büyük indirim,cnnturktekno
kameralı telefon nasıl olacak,cnnturktekno
Note ’un Unpacked etkinliği Ağustos’ta,cnnturktekno
Galaxy Note  tanıtımdan ay önce ortaya çıktı,cnnturktekno
Galaxy Note puanları ile iç açmıyor,cnnturktekno
Samsung’un Oreo güncellemeleri gecikecek,cnnturktekno
Honor bu ay Türkiye’de satışa sunuluyor,cnnturktekno
 Hitman hakkında yeni detaylar geldi,cnnturktekno
İstanbul’a bir de buradan bakın,cnnturktekno
 Resident Evil ekran görüntüleri,cnnturktekno
Çocuk takip cihazları sayesinde çocuğunuzun konumunu an ve an takip edebilirsiniz İşte en…,cnnturktekno
En iyi çocuk takip cihazları Çocuğunuzun her an nerede olduğunu bilin,cnnturktekno
Bu uygulamalar çocuğunuzun yerini adım adım gösteriyor,cnnturktekno
Galaxy On6 özellikleri neler,cnnturktekno
 Herkesin kullandığı anlık mesajlaşma hizmeti WhatsApp üzerinden çocuğunuzu takip edebileceğinizi biliyor muydunuz https…,cnnturktekno
Microsofttan blockchain girişimi için işbirliği,cnnturktekno
 PUBG ve Fortnite arasındaki dava sona erdi,cnnturktekno
 Final Fantasy XV için Power Rangers modu çıktı,cnnturktekno
iPhone s Hindistan’da üretilecek,cnnturktekno
iPhone modelleri yan yana,cnnturktekno
iOS Beta ile şarj sorunu çözülüyor,cnnturktekno
Plajda evlenme teklifi için yeni buluş Kum yazıcısı,cnnturktekno
Akıllı telefonlarda parmak izi sensörüne yeni görev Bundan böyle,cnnturktekno
Facebookta sular durulmuyor Bilgi paylaşmaya devam etmişler,cnnturktekno
 NBA Live kapağı için sürpriz isim,cnnturktekno
 Halo artık PC’de oynanabiliyor,cnnturktekno
 Fortnite Mayıs’ta rekor kırdı,cnnturktekno
 Devil May Cry  Nero’nun hikayesine odaklanacak,cnnturktekno
Instagram video görüşme özelliği kullanımda,cnnturktekno
dolara akıllı telefon Alcatel ,cnnturktekno
Bu Android uygulamaları iPhone sahiplerini kıskandıracak,cnnturktekno
dolar seviyesindeki telefonların karşılaştırmaları,cnnturktekno
Meizu X8 performans ve fiyat bazında iddialı bir model,cnnturktekno
Xiaomi Mi Pad  FaceID ile geliyor,cnnturktekno
Tether uygulaması ile modemleri yönetin,cnnturktekno
Sabit diskler ses dalgasıyla saldırı yöntemi ile zarar görüyor,cnnturktekno
Mojave Public Beta nasıl yüklenir,cnnturktekno
 The Crew açık betası başladı,cnnturktekno
Huawei Mate Pro sizi artık yüzünüzden tanıyacak,cnnturktekno
Galaxy Note tanıtım tarihi belli oldu,cnnturktekno
iPhone modellerinin Türkiye çıkış fiyatları,cnnturktekno
Sony Mobile Türkiye’den çekiliyor,cnnturktekno
En iyi kablosuz şarj cihazları,cnnturktekno
Facebook ile ilgili yeni iddia Telefonları dinliyor,cnnturktekno
Instagramdan yeni bir özellik daha,cnnturktekno
Kıyametin Temmuz günü kopacağına inanıyorlar,cnnturktekno
Google Earth evinizle Paris arasındaki mesafeyi ölçecek,cnnturktekno
Pirinç tanesinden bile küçük bilgisayar,cnnturktekno
Kıyametin Temmuz günü kopacağına inanıyorlar,cnnturktekno
Defkey Klavye kısayolları rehberi,cnnturktekno
Whatsapptan eski iPhone sahiplerine çok kötü haber,cnnturktekno
Instagramdan yeni uygulama IGTV,cnnturktekno
Instagram yeni uygulamasını yayımladı IGTV,cnnturktekno
Sosyal medyada çocuğunuzun fotoğrafını paylaşmayın,cnnturktekno
Surface Pro ’da başarı isteniyor,cnnturktekno
Pixel XLin detayları hala belli değil,cnnturktekno
Xiaomi Mi Max  farklı versiyonla gelecek,cnnturktekno
Şarjınızı yiyip bitiren uygulamalar,cnnturktekno
 SpiderMan için yeni oynanış videosu,cnnturktekno
Nubia Z18 için ZTE’den onay geldi,cnnturktekno
İşte iptal edilen katlanabilir akıllı telefon modeli,cnnturktekno
Samsung ipin ucunda,cnnturktekno
Instagram ekran görüntüsü alınca neler oluyor,cnnturktekno
 Windows oyun modu ile oyunlar coşacak,cnnturktekno
Gmail artık yapay zekaya sahip,cnnturktekno
Facebookta yeni dönem başlıyor yaş altında olan herkes artık,cnnturktekno
PlayStation için artık yolun sonu gelmiş olabilir,cnnturktekno
 Metro Eus için nefes kesen oynanış videosu,cnnturktekno
 Assassins Creed Odyssey hakkında bilinen tüm detaylar,cnnturktekno
 PES  Türkiye Süper Ligiyle gelebilir,cnnturktekno
Güle güle Windows ve Windows Vista,cnnturktekno
Galaxy Note komple sızdı,cnnturktekno
Asus GB RAM’li telefon için kolları sıvadı,cnnturktekno
 Super Smash Bros Ultimate bomba gibi geliyor,cnnturktekno
 For Honor ücretsiz oldu,cnnturktekno
OnePlus vs Galaxy S9 kamera karşılaştırması,cnnturktekno
Yeni iPadin tasarımıyla fark yaratması bekleniyor,cnnturktekno
PlayStation için artık yolun sonu gelmiş olabilir,cnnturktekno
 Yeni Xbox ’de geliyor,cnnturktekno
iPhone ve iPhone SE2 arasında ikilem yaşıyor,cnnturktekno
 PlayStation için artık yolun sonu gelmiş olabilir,cnnturktekno
 Hitman sistem gereksinimleri,cnnturktekno
iOS batarya sorunu çözülecek mi,cnnturktekno
 FIFA fiyatı dudak uçuklatıyor,cnnturktekno
 Doom resmen duyuruldu,cnnturktekno
 Cyberpunk ’de The Witcher kodu,cnnturktekno
 Fallout Shelter konsollara geldi,cnnturktekno
Kingston GB SDCG microSD kart inceleme,cnnturktekno
eria XZ2 için Android P Beta çıktı,cnnturktekno
Samsung Galaxy A6ın kutusundan neler çıkıyor,cnnturktekno
Samsung Apple’a rağmen zirvede,cnnturktekno
Instagram Hikayeler daha verimli olacak,cnnturktekno
Nehre düşen iPhone X hala çalışıyor,cnnturktekno
 Call of Duty Black Ops oyunu ücretsiz oldu,cnnturktekno
Pill iPhone X için güncellendi,cnnturktekno
kameralı iPhone nasıl olacak,cnnturktekno
 Nintendo Switch Türkiye pazarında başarılı olabilecek mi,cnnturktekno
’in en popüler telefonları,cnnturktekno
Honor için yeni güncelleme,cnnturktekno
 PlayStation için ilk resmi duyuru geldi,cnnturktekno
Xiaomi Mi Band Türkiyede satışta,cnnturktekno
 Cyberpunk ’nin tanıtım videosu geldi,cnnturktekno
 The Last of Us Part için nefes kesen video,cnnturktekno
 Beyond Good and Evil dinamikleriyle dikkat çekiyor,cnnturktekno
iOS Beta ile neler geliyor,cnnturktekno
 PS4’e hangi oyunlar gelecek,cnnturktekno
Snapdragon ’a rakip Kirin geliyor,cnnturktekno
Vivo NEX Se dair yeni detaylar,cnnturktekno
Bitcoin’e geçit yok,cnnturktekno
Galaxy Note çıkış tarihi netlik kazandı,cnnturktekno
Babalar günü için en ucuz hediyeler,cnnturktekno
Anthem Türkiye fiyatı zamlandı,cnnturktekno
 Shadow of the Tomb Raider şahane görünüyor,cnnturktekno
Bu telefon rakip tanımıyor,cnnturktekno
 PlayStation için ilk resmi duyuru geldi,cnnturktekno
iOS Beta ile neler geliyor,cnnturktekno
 Assassin’s Creed Odyssey bomba gibi geliyor,cnnturktekno
Galaxy S8 fiyatı düşmeye devam ediyor,cnnturktekno
CeBIT kapılarını açtı Türkiye firma ile fuarda,cnnturktekno
Yine Facebook yine skandal Bu kez de bir hatadan dolayı milyonlarca kullanıcının gizlilik ayarlarının değiştiği…,cnnturktekno
Şarjınızı yiyip bitiren uygulamalar,cnnturktekno
Yüksek hızlı G LTE Router Archer MR400,cnnturktekno
iPhone ve iPhone X Plus nasıl olacak,cnnturktekno
Galaxy S9 vs iPhone X portre modu karşılaştırması,cnnturktekno
SAR değeri nedir En yüksek değer kaç olmalıdır,cnnturktekno
Orta seviye uygun fiyatlı Google Pixel geliyor,cnnturktekno
Meksika’da sanal transferle milyon çalındı,cnnturktekno
 Bus Simulator sona yaklaştı,cnnturktekno
iOS Beta nasıl yüklenir,cnnturktekno
Asus ZenBook Proya yakından bakıyoruz,cnnturktekno
Asus Rog Phone ön incelemesi,cnnturktekno
iPhone ve iPhone X Plus nasıl olacak,cnnturktekno
Facebook yalan haber tespiti nasıl kullanılır,cnnturktekno
Github ve Microsoft güçlerini birleştiriyor,cnnturktekno
MacBook Pro özellikleri nasıl olacak,cnnturktekno
Şarjınızı yiyip bitiren uygulamalar,cnnturktekno
Mobil cihazlarda Facebook kullananlar dikkat,cnnturktekno
 Red Dead Redemption ön sipariş bonusları açıklandı,cnnturktekno
ZTE kötünün iyisini seçmek zorunda,cnnturktekno
Google tablet bölümünü yanlışlıkla kaldırdı,cnnturktekno
 Oyunculara özel telefonunu tanıttı,cnnturktekno
Apple iOS sürümünü tanıttı,cnnturktekno
 Pokemon Gold için yıllık demo,cnnturktekno
Samsung Türkiye güncelleme takvimini açıkladı,cnnturktekno
Eski Galaxy modelleri güncelleme almayacak,cnnturktekno
 Assassins Creed Odyssey geliyor,cnnturktekno
 Nintendo Switch için Fortnite için geri sayım başladı,cnnturktekno
Konuş konuş şarjı bitmeyen akıllı telefonlar,cnnturktekno
Galaxy A8 hoparlör sorunu can sıkıyor,cnnturktekno
WhatsApp yaş sınırı nedir,cnnturktekno
Şarjınızı yiyip bitiren uygulamalar,cnnturktekno
 The Crew den inanılmaz görüntüler,cnnturktekno
Hem çentikli hem de ucuz akıllı telefonlar,cnnturktekno
iPhone X vs OnePlus  Portre modu karşılaştırması,cnnturktekno
Üç kameralı iPhone da,cnnturktekno
 Battlefield bomba gibi geliyor,cnnturktekno
 PlayStation Classic Edition ile karşımıza çıkabilir,cnnturktekno
 Xbox için 75260 güncellemesi yayınlandı,cnnturktekno
WhatsApptaki büyük hatayı çözmek için bunları yapmanız gerekiyor,cnnturktekno
Galaxy Note hayal kırıklığı yaratabilir,cnnturktekno
iCloud Mesajlar nasıl kullanılır,cnnturktekno
Chrome ile gelen yenilikler,cnnturktekno
Yeni Nokia modelleri,cnnturktekno
 GameCube oyunları HD çözünürlükte,cnnturktekno
Samsung Türkiye güncelleme takvimini açıkladı,cnnturktekno
OnePlus yüz okuma teknolojisi kandırılabiliyor,cnnturktekno
 İlk Türk yapımı Switch oyunu Doughlings Arcade,cnnturktekno
LG V35 ThinQ özellikleri,cnnturktekno
Çentikli tasarıma sahip en ucuz akıllı telefon modelleri,cnnturktekno
 boyutlu oyun deneyimi Honor Play ile geliyor,cnnturktekno
 FIFA Dünya Kupası güncellemesi ile gelen yenilikler,cnnturktekno
 Yeni Pokemon oyunları Kasım’da geliyor,cnnturktekno
 Korku oyunu SON PS4 için geliyor,cnnturktekno
LG V35 ThinQ vs LG G7 ThinQ karşılaştırması,cnnturktekno
Apple WWDC ’de şaşırtabilir,cnnturktekno
Xiaomi Mi ile çekilmiş fotoğraflar dikkat çekti,cnnturktekno
 Xbox Live Gold Haziran oyunları,cnnturktekno
MIUI neler sunuyor,cnnturktekno
MIUI alacak Xiaomi modelleri,cnnturktekno
iOS Beta ile yenilik geliyor mu,cnnturktekno
Üç kameralı iPhone,cnnturktekno
Google Pixel için Foxconn ile temasa geçti,cnnturktekno
Honor Play özel bir KirinOS ile gelecek,cnnturktekno
En kötü Android telefonlar,cnnturktekno
Apple Watch için yeni kadran yolda,cnnturktekno
 PUBG Fortnite rekabeti mahkemeye taşınıyor,cnnturktekno
Xiaomi Mi vs iPhone X karşılaştırması,cnnturktekno
 Fallout online rol yapma oyunu olacak,cnnturktekno
En yüksek bataryalı akıllı telefon modelleri,cnnturktekno
WhatsAppTwitter ve Facebook gibi sosyal medya uygulamalarını kullananlar vergi ödeyecek,cnnturktekno
Xiaomi Türkiye pazarına giriş yapıyor,cnnturktekno
Instagram sessize alma özelliği nasıl kullanılır,cnnturktekno
BlackBerry Key2 ile firma özüne dönecek,cnnturktekno
LG G6 için Android Oreo güncellemesi geldi,cnnturktekno
Vivo Z1 özellikleri ve fiyatı ile öne çıkıyor,cnnturktekno
OnePlus ve T için yüz tanıma özelliği geldi,cnnturktekno
 Yeni God of War için satış rakamları açıklandı,cnnturktekno
Tam ekranlı Vivo NEX geliyor,cnnturktekno
HTC U12 satın alacak olanlar dikkat,cnnturktekno
iPhone SE geliyor,cnnturktekno
Google Chrome Android P’den esinleniyor,cnnturktekno
 PES ’da Türkiye Süper Ligi bulunabilir,cnnturktekno
 World War Z oyunu için ilk oynanış videosu,cnnturktekno
Moto G Mod Moto Z3 Play ile birlikte ortaya çıktı,cnnturktekno
ABD senatörleri Trump’ın ZTE kararına tepkili,cnnturktekno
Samsung yeni işlemcileri için açıklama yaptı,cnnturktekno
Galax Note GB dahili depolama ile geliyor,cnnturktekno
Galaxy J7 Prime özellikleri ve Türkiye fiyatı,cnnturktekno
 PSP emülatörü güncellendi,cnnturktekno
CMD komutları ile Windows ustası olun,cnnturktekno
 Apple ile Steam krizi çözüme kavuşuyor,cnnturktekno
Ücretsiz VPN servisleri bilgilerinizi satıyor mu,cnnturktekno
 Yakuza  ve PS4’e geliyor,cnnturktekno
Whatsapp mesajlarınızın başkaları tarafından okunma riskini ortadan kaldırmak ister misiniz…,cnnturktekno
Whatsappta büyük hata Yeni fark ettiler,cnnturktekno
Instagram sessize alma özelliği nasıl kullanılır,cnnturktekno
En popüler Nokia modeli,cnnturktekno
Hangisi daha iyi fotoğraf çekiyor OnePlus vs Galaxy S9 vs Pixel XL vs iPhone X,cnnturktekno
Akıllı telefon almanın tam zamanı Nedeni haberimizde,cnnturktekno
Sony telefon pazarından çekilecek mi,cnnturktekno
iPhone nasıl olacak,cnnturktekno
GeForce GTX ortaya çıktı,cnnturktekno
Yanlışlıkla sızdırıldı,cnnturktekno
 Days Gone için geri sayım başladı,cnnturktekno
Speculative Store Bypass nedir,cnnturktekno
Dünyanın en pahalı telefon düşürme testi,cnnturktekno
 Sony’den PlayStation itirafı,cnnturktekno
Xiaomi Mi özellikleri ve diğer detayları,cnnturktekno
Nokia X6 saniyede tükendi,cnnturktekno
Dünyaca ünlü isim tarafından tasarlandı,cnnturktekno
LGden yeni telefonlar,cnnturktekno
Galaxy J6 özellikleri ve diğer detaylar,cnnturktekno
 Call of Duty Black Ops için yeni video,cnnturktekno
WhatsAppa yepyeni bir özellik daha geldi,cnnturktekno
 Battlefield için ilk teaser videosunu yayınladı,cnnturktekno
Galaxy A6 yakında Türkiye’ye de gelecek,cnnturktekno
Windows için yeni güncelleme ile yapılan iyileştirmeler,cnnturktekno
 The Division çıkış tarihi açıklandı,cnnturktekno
Yeni model cep yönlendiricisini satışa sundu,cnnturktekno
Honor vs Huawei P20 karşılaştırması,cnnturktekno
Galaxy serisine Oreo güncellemesi,cnnturktekno
Grup video görüşme özelliği WhatsApp’a geliyor,cnnturktekno
Huawei Y5 Prime 2018 ortaya çıktı,cnnturktekno
Samsung Galaxy J4nin detayları belli oldu,cnnturktekno
 Android için Fortnite yaz aylarında geliyor,cnnturktekno
Samsung Bixby için geri sayım başladı,cnnturktekno
 Resident Evil sadece internet üzerinden oynanacak,cnnturktekno
Galaxy S Light Luxury özellikleri nasıl olacak,cnnturktekno
ZTE için yeni yaptırımlar geliyor,cnnturktekno
 Uncharted şimdi PC’ye geldi,cnnturktekno
İPhone Xin fiyatı artabilir,cnnturktekno
 Rage oyununa dair ilk detaylar,cnnturktekno
 UBER mi sarı taksi mi,cnnturktekno
Apple vazgeçmiyor,cnnturktekno
Grup video görüşme özelliği WhatsApp’a geliyor,cnnturktekno
Facebook toparlanıyor,cnnturktekno
 Haftanın yeni oyunları,cnnturktekno
Roboik yarışmaları lansman toplantısı yapıldı,cnnturktekno
HTC Blockchain destekli telefon üretti,cnnturktekno
Asus Zenfone şaşırttı,cnnturktekno
 Steam oyunları Android telefonlarda,cnnturktekno
 Galactic Civilizations II ücretsiz oldu,cnnturktekno
iOS Beta ile gelen yenilikler,cnnturktekno
Samsung Galaxy S9u iPhone ile karşılaştırdı,cnnturktekno
Audioengine resmi olarak Türkiye’de,cnnturktekno
Nokia X6 Türkiye’ye geliyor,cnnturktekno
 Call of Duty Black Ops e yakından bakıyoruz,cnnturktekno
Instagram yenilendi,cnnturktekno
Çift kameralı en ucuz akıllı telefon,cnnturktekno
OnePlus Marvel Avengers böyle görünecek,cnnturktekno
Instagram yeni özellikler ile güncelleniyor,cnnturktekno
Çift kameralı en ucuz akıllı telefon,cnnturktekno
Telefon fiyatları değişecek mi,cnnturktekno
YouTube gizlilik modu Android’de test ediliyor,cnnturktekno
Pokemon Yellow Nintendo Switch’e gelecek,cnnturktekno
ZTE Nubia Z18 AnTuTu’da rekor kırdı,cnnturktekno
Elon Musk için iPhone X kılıfı,cnnturktekno
OnePlus ne kadar dayanıklı,cnnturktekno
Şarj sorunundan bıkanlar için en iyi pil süresine sahip akıllı telefon,cnnturktekno
Galaxy Tab S4 Android pazarında tahta oturacak,cnnturktekno
Samsung Oreo güncellemesinde sorunlar yaşanıyor,cnnturktekno
Battlefield benzersiz bir deneyim sunacak,cnnturktekno
LG G7 ThinQ fiyatı ne kadar olacak,cnnturktekno
 F1 çıkış tarihi ve diğer detaylar,cnnturktekno
Android P adı ne olacak sorusu kafaları hala meşgul ediyor,cnnturktekno
 Mayıs  İzmirin işgaline karşı yurdun dört bir yanında protesto gösterileri düzenlendi,cnnturktekno
Nostaljik dokunuş,cnnturktekno
Google gizlilik politikası ile hangi bilgiler toplanacak,cnnturktekno
 Rage ile emsalsiz bir deneyim,cnnturktekno
Google Drive’in fişi çekildi,cnnturktekno
 Nintendo Switch TeamXecuter tarafından kırıldı,cnnturktekno
iPhone X’e fark attı,cnnturktekno
Yeni iPhone ucuz olabilir,cnnturktekno
 PlayStation bu yıl tanıtılmayacak,cnnturktekno
Google Haberler uygulaması yenilendi,cnnturktekno
Eticaret alışverişlerinde randevulu teslimat dönemi,cnnturktekno
 Nokia için Android Oreo ile gelen yenilikler,cnnturktekno
Telefonunuzun pili bitmeden okuyun En iyi pil süresine sahip akıllı telefon,cnnturktekno
OnePlus fiyatı rakiplerinin çok daha aşağısında,cnnturktekno
 Mayıs  Mustafa Kemal Atatürk ve arkadaşları Samsuna gitmek için Bandırma Vapuruna binip İstanbuldan yola çıktı …,cnnturktekno
Nokia için Android Oreo ile gelen yenilikler,cnnturktekno
iPhone Xi hedef alacak,cnnturktekno
