Tweet,Category
Apple’dan 00 TL’lik bataryalı kılıf İşte Smart Battery Casein tüm detayları,cnnturktekno
Android Pie güncellemesini devreye girmesi ile Samsung cihazlar tamamen değişiyor İşte…,cnnturktekno
 Far Cry New Dawn sistem gereksinimleri,cnnturktekno
 Nintendo Switch için en iyi indie oyun,cnnturktekno
DİKKAT Sosyal medyanın yeni kabusu… Banka hesabınızı boşaltabilirler,cnnturktekno
Samsung Galaxy A50 göz kırptı,cnnturktekno
Android Pie’da uyarlanabilir parlaklığı kolayca sıfırlayın,cnnturktekno
Yeni nesil teknolojiler ve işin değişen doğası için yaz…,cnnturktekno
Huawei zirve yürüyüşüne devam ediyor,cnnturktekno
Devasa ekranı ve kamerasıyla dikkat çekiyor,cnnturktekno
Tüm dünyada trend oldu Türkiyede de herkes Instagramdan paylaşmaya başladı,cnnturktekno
 Bu otomobil duygularınıza göre hareket ediyor,cnnturktekno
WhatsApptan önemli yenilik Büyük kolaylık sağlayacak,cnnturktekno
G ile ameliyat yaptılar,cnnturktekno
iPhone in yeni özellikleri sızdırıldı kamera süper hızlı WiFi,cnnturktekno
 Red Dead Redemption PC’de oynanabiliyor,cnnturktekno
YouTubeda yeri yok Milyonlarca kez izlenen videolara yasak geldi,cnnturktekno
Fiyatı beklediğinizden yüksek olacak,cnnturktekno
Google Pixel Lite XL geliyor,cnnturktekno
TL altına alınabilecek en iyi akıllı telefonlar,cnnturktekno
Efsane geri dönüyor Yeni iPod ’da gelecek,cnnturktekno
Fiyatı düşürdükçe düşürdüler iPhone satışlarında inanılmaz düşüş,cnnturktekno
Windows kullanıcılarına kötü haber,cnnturktekno
Apple AirPower için geri sayım başladı,cnnturktekno
Kıyamet alameti olduğuna inanılıyor Süper Kanlı Ay Tutulması tartışmaları da beraberinde ge…,cnnturktekno
Aya gönderilen tohumlar filizlendi,cnnturktekno
Tüm dünya bunları kullanıyor ama Bu şifreleri kırmak çok kolay,cnnturktekno
 En çok hangi oyunlar satılıyor,cnnturktekno
 Capcom remastered nasıl yapılır dersi verdi İşte Resident Evil nin K ekran görüntüleri https…,cnnturktekno
Dünyaya ışık yılı uzaklıkta ilginç keşif Gezegen oluşumuna uygun ve şekli alışılmış…,cnnturktekno
Xiaomi telefonların şaşırtan fiyatları,cnnturktekno
OYUN  başlıyor,cnnturktekno
Dijital itibar yönetimi sizin için neden önemli Esra Öz için yazdı,cnnturktekno
Liderliği elden bırakmıyorlar En yalancılar yaşın üstündekiler,cnnturktekno
Yeni nesil teknolojiler ve işin değişen doğası için yaz…,cnnturktekno
 Cumhuriyetimizin kurucusu Gazi Mustafa Kemal Atatürkün annesi  vefatının yıldönümünde törenlerle anıldı https…,cnnturktekno
Aman DİKKAT WhatsApp yüzünden hayatınız mahvolabilir 🤯 Mesajlarınız başka kişilere gide…,cnnturktekno
Googleda en çok neleri arıyoruz,cnnturktekno
OnePlus ilk kez görüntülendi,cnnturktekno
YouTubea video yükleyenler için kötü haber Peki bundan sonra ne olacak,cnnturktekno
WhatsAppa pazar sabahı bomba güncelleme Yazışırken artık,cnnturktekno
Samsung Galaxy S10 ne kadar hızlı olacak,cnnturktekno
Appledan bu kez kameralı iPhone geliyor,cnnturktekno
WhatsAppın bilinmeyen özellikleri,cnnturktekno
Google Assistant telefonunuz kilitli olsa bile yanıt verecek,cnnturktekno
Çinliler yaptı öyle bir özelliği var ki,cnnturktekno
Xbox Türkiye’den yine zam hamlesi,cnnturktekno
Uzayın derinliklerinde radyo sinyali tespit edildi,cnnturktekno
Google Assistanta bir özellik daha Noktalama işaretlerini kendi ekleyecek,cnnturktekno
Instagramın bu özelliği çok sevilecek Birden fazla hesaptan aynı anda,cnnturktekno
Metro Eus için hikaye videosu yayınlandı,cnnturktekno
AirPods’a ucuz alternatif AirDots Pro,cnnturktekno
Tidal Master Android’e geliyor,cnnturktekno
Ayna ayna söyle bana Bir aynadan fazlasını isteyebilir misiniz İşte akıllı ayna,cnnturktekno
Dikkat WhatsApp Gold virüsü hortladı İşte korunmak için dikkat etmeniz gerekenler,cnnturktekno
Tüm WhatsApp kullanıcılarını ilgilendiriyor Aylardır sakladığı özelliği ortaya çıktı,cnnturktekno
Bilim insanları duyurdu Yeni radyo sinyalleri tespit edildi,cnnturktekno
 Audi’den sanal gerçeklik deneyimi,cnnturktekno
Anthem atmosferiyle büyülemeye devam ediyor,cnnturktekno
Xiaomi Black Shark için geri sayım başladı,cnnturktekno
Google Pixel ses sorunu çözüldü,cnnturktekno
Kırmızı Huawei Mate Pro geliyor,cnnturktekno
Huawei Matebook çok iddialı geliyor,cnnturktekno
iPhone kullanıcıları dikkat Dolandırıcıların hedefi olmayın,cnnturktekno
 Yeni nesil teknolojiler ve işin değişen doğası için yazdı https…,cnnturktekno
milyardan fazla paylaşım yapıldı İşte in en çok etkileşim alan tweeti,cnnturktekno
Google yeni planlarını duyurdu Artık pek çok uygulamada göreceksiniz,cnnturktekno
Geleceğin en iyi ve en kötü meslekleri açıklandı,cnnturktekno
 Çocuklara yaşından önce telefon alınmamalı,cnnturktekno
 Silkroad Online mobil oyununu çıkartacak mı,cnnturktekno
Yeni nesil teknolojiler ve işin değişen doğası için yaz…,cnnturktekno
PS4 satışları milyona yaklaştı,cnnturktekno
iPhone böyle olacak,cnnturktekno
Razer Blade özellikleri ve fiyatı,cnnturktekno
00 mAh kapasiteli PowerBank,cnnturktekno
Yasa dışı kripto madencilik çiftlikleri yükselişte,cnnturktekno
WiFi teknolojili ürünlere hazır olun,cnnturktekno
Yüksek performansa merhaba deyin,cnnturktekno
İşte iPhone için WhatsApp’a gelen yenilikler,cnnturktekno
Oyun tutkunları için CES da tanıtıldı Masaüstü ve dizüstü bilgisayar birleşti,cnnturktekno
 İşte en çok satan oyun konsolları,cnnturktekno
 Call of Duty Ghosts için ilk açıklama,cnnturktekno
 Super Smash Bros Ultimate incelemesi,cnnturktekno
’in en iyi torrent siteleri,cnnturktekno
Akıllı TVler siber saldırıların hedefi olabilir,cnnturktekno
Windows ve Vista kullanıcıları için kötü haber,cnnturktekno
Yeni Xbox One kontrolcüsü geliyor,cnnturktekno
Huawei Mate Pro nasıl olacak,cnnturktekno
iOS güncellemesi nasıl olacak ve ne zaman yayınlanacak,cnnturktekno
Şimdiye kadar yapılmış en güçlü konsol,cnnturktekno
TL altına alınabilecek en iyi akıllı telefonlar,cnnturktekno
Mesajlar resimler videolar WhatsApptan yeni özellik birden,cnnturktekno
Şimdiye kadar yapılan en güçlü roket Elon Musk ilk görüntüyü paylaştı,cnnturktekno
Hangi ülke internete daha hızlı bağlanıyor,cnnturktekno
 Türkiye Mahmut Hocasını Yaşar Ustasını özlüyor,cnnturktekno
O iPhonelar tarih oluyor,cnnturktekno
Çalışılabilecek en iyi teknoloji şirketi,cnnturktekno
Instagram İran’da engellenebilir,cnnturktekno
 Days Gone’ın multiplayer modu Sony’den dönmüş,cnnturktekno
 Mortal Kombat için ilk ekran görüntüleri,cnnturktekno
 En çok para kazandıran PC oyunları,cnnturktekno
 Max Payne için yayınlanan muhteşem konseptler,cnnturktekno
 Fortnite 0 İçerik Güncellemesi ile gelen yenilikler,cnnturktekno
 Dead Cells için henüz bir hazırlık yok,cnnturktekno
 Project Cars  NFS Shift tarzında olacak,cnnturktekno
Googleın yeni özelliği kullanıcıların yüzünü güldürecek,cnnturktekno
Galaxy S10 boyutu ortaya çıktı,cnnturktekno
Apple Watch indirime girdi,cnnturktekno
Daha büyük ekran daha iyi pil performansı,cnnturktekno
Yüksek WiFi hızlarına ulaşıyor,cnnturktekno
Messenger siyah tema ile güncelleniyor,cnnturktekno
iPhone Xr Apple’ın yüzünü güldürdü,cnnturktekno
 Prey bu mod ile böyle görünüyor,cnnturktekno
 Street Fighter V için reklam dönemi kısa sürdü,cnnturktekno
Hollandalı astronot uzaydan yanlışlıkla ’i aradı,cnnturktekno
En yüksek kamera çözünürlüğüne sahip telefonlar,cnnturktekno
’in en iyi Windows uygulamaları,cnnturktekno
iOS güncellemesi dert oldu,cnnturktekno
Netflix çok büyük bir karar aldı Artık satın alma seçenekleri,cnnturktekno
İşte ’un en çok beklenen akıllı telefonları,cnnturktekno
WhatsApp o telefonların fişini bu akşam çekiyor,cnnturktekno
İran yargısından Instagramı kapatma kararı,cnnturktekno
NASA tüm dünyaya duyurdu Bilinen sınırların ötesinde bir isim görüntüledik,cnnturktekno
Nokianın kameralı telefonunun videosu yayınlandı,cnnturktekno
Samsung bu kez akıllı ayakkabısıyla geliyor,cnnturktekno
 yu  doğum gününde saygı ve özlemle anıyoruz ️,cnnturktekno
Şehit haberlerine üzülen öğrenciler askeri robot geliştirdi,cnnturktekno
Nintendo Switch’e gelmesi gereken Wii U oyunları,cnnturktekno
TL ile kilometre yol giden elektrikli otomobil üretildi,cnnturktekno
 En iyi Remastered PlayStation oyunu,cnnturktekno
 Depresyonu yenen molekül araştırmasına ödül,cnnturktekno
ilde bin kadın teknolojiyle buluştu Fatoş Karahasan için yazdı,cnnturktekno
İlginç gelişme Bilim insanları bakırdan altın yaptı,cnnturktekno
iPad mini nasıl olacak,cnnturktekno
Launch Center Pro ne işe yarıyor,cnnturktekno
Telefonlara bandrol vergisi geliyor,cnnturktekno
Galaxy S10 Plus böyle görünecek,cnnturktekno
Google ’de ne kadar kar elde etti,cnnturktekno
Bolt Samsung Galaxy Note ’un yazılımında gözüktü,cnnturktekno
PlayStation Classic Türkiye fiyatı alınabilir seviyeye indi,cnnturktekno
Ücretli olacak mı diye çok konuşulmuştu Turkcell Hızlı Giriş nedir Nasıl kullanılır,cnnturktekno
Ücretli olacak mı Turkcell Vodafone ve Türk Telekomdan açıklama geldi,cnnturktekno
 teknoloji dünyasına kısa bir bakış için yazdı,cnnturktekno
WhatsApp Webe de geldi Artık hem video izlerken hem de,cnnturktekno
Hangi telefon daha iyi portre modu fotoğrafları çekiyor,cnnturktekno
OnePlus T DMark puanı şaşırttı,cnnturktekno
iPad Mini geliyor,cnnturktekno
Performans tasarım hız İşte ’in en güçlü akıllı telefonları,cnnturktekno
teknoloji dünyasına kısa bir bakış için yazdı,cnnturktekno
Googleda en çok bunları aradık Doğu Ekspresi Mevlana Hubris sendromu Ustura Kemal ve ,cnnturktekno
 teknoloji dünyasına kısa bir bakış Ozan Onat için yazdı,cnnturktekno
 Cep telefonu kullanıcıları DİKKAT Ekstra para alınmıyordu Artık özelliği açtığınızda ücret yansıyaca…,cnnturktekno
Apple tepki çeken uygulamayı kaldırdı,cnnturktekno
Canlı yayındaydılar Space X bir ilki daha gerçekleştirdi,cnnturktekno
WhatsApptan gelen tehlikeye dikkat Hedefte Türkiye var,cnnturktekno
NASA görüntüledi Dünyaya doğru yaklaşıyor,cnnturktekno
Türk bilim insanlarından D görüntüleme teknolojisi,cnnturktekno
Apple Android ile Tweet attı,cnnturktekno
Huaweiden görme engelliler için özel uygulama,cnnturktekno
İşte tüm zamanların en çok satan telefonu,cnnturktekno
WhatsApp kullananlara önemli duyuru Facebook açıkladı Kripto para,cnnturktekno
 CNN TÜRK Kanal D ve Radyo D binasına işte böyle girdi Topie Mutlu adımlarla tırmandı merdivenleri Kimse durdurmadı durdura…,cnnturktekno
İşte dünyanın en pahalı internetini kullanan ülkeler,cnnturktekno
Facebook açıkladı Seçimler öncesinde sahte hesapları kapattık,cnnturktekno
Samsung Galaxy A9 inceleme altında,cnnturktekno
Facebook için yeni bir kişisel veri krizi kapıda,cnnturktekno
Sosyal mühendislik Siber saldırıların arkasında yatan gerçekler,cnnturktekno
Microsofttan yeni bir işletim sistemi daha,cnnturktekno
Instagramda önemli değişiklik Müzikli yanıt,cnnturktekno
 Çinde tasarlanan insansız hava aracı acil durumlarda dört ayrı parçaya bölünerek güvenlik ağına dönüşüyor Ve insanların tah…,cnnturktekno
Twitterdan büyük güncelleme Milyonlarca kullanıcıyı yakından ilgilendiriyor,cnnturktekno
Dikkat Google artık desteklemeyecek,cnnturktekno
Delikli ekran tasarımına sahip Nova tanıtıldı,cnnturktekno
PayPal’dan para çalmaya odaklanan yazılım,cnnturktekno
Appledan Türkiye müjdesi Bugün yayınlandı,cnnturktekno
Casper’ın yeni akıllı telefonunun çizimleri sızdırıldı,cnnturktekno
Dünyanın korktuğu teknoloji sahaya sürülüyor,cnnturktekno
Gerçek çok farklı 060ın altında olmalı ama İşte en çok radyasyon yayan telefonlar,cnnturktekno
 “Bilgiye kolay erişim beyni pasifleştiriyor”,cnnturktekno
 Milli İHAnın gözü mavi vatanın üzerinde olacak,cnnturktekno
 Testleri başarıyla tamamladı Türkiyenin yeni radarı kuş uçurtmayacak,cnnturktekno
 ABD ve Çin tetikledi Siber savaşa hazırlanıyorlar,cnnturktekno
 Apple’dan Haftası’na özel video,cnnturktekno
Apple’dan Haftası’na özel video,cnnturktekno
İşte en çok kazandıran mobil uygulamalar,cnnturktekno
Juno uzay aracı paylaştı Jüpiterdeki dev kasırgalar,cnnturktekno
Türkiye ve dünyada yılında en çok neler arandı,cnnturktekno
Güvenlik endişeleri nedeniyle uzun süredir tartışılıyordu Google kimseye satmayacak,cnnturktekno
İnanamayacaksınız Sadece adet mıknatıs bakır tel ile,cnnturktekno
 Tarifeler de baştan aşağı değişecek Peki fiyat artışı olacak mı,cnnturktekno
Milyonlarca kişi etkilenecek da konrsanların hedefi,cnnturktekno
Sadece tek dokunuşla Google Chrome kullananlara önemli uyarı,cnnturktekno
 Her an yayın hayatına başlayabilir Efsane televizyon kanalı geri dönüyor,cnnturktekno
 WhatsApptan güzel bir haber daha Daha keyifli olacak,cnnturktekno
Newton Torricelli Galileoya ilham verdi,cnnturktekno
WhatsApptan güzel bir haber daha Daha keyifli olacak,cnnturktekno
Yılın son gök olayı için geri sayım başladı Geminid Meteor Yağmuru ne zaman başlayacak,cnnturktekno
Sadece kibrit kutusu boyutunda ama diziüstü bilgisayar sarj edecek,cnnturktekno
Powerbank ailesini genişletti,cnnturktekno
Kotasız internet tarifeleri açıklandı İşte yeni internet fiyatları,cnnturktekno
Honor View  MP’lik kamerasıyla dikkat çekiyor,cnnturktekno
Tüketiciler Apple’ın fiyat politikasına tepkili,cnnturktekno
Google Plus’ın sonuna gelindi,cnnturktekno
Apple ürünlerine yasak,cnnturktekno
Samsung sahte ürünler üreten bir firma ile işbirliği yapacak,cnnturktekno
 Bakan Albayraktan önemli açıklamalar Dünyada GSM altyapısı böyle güçlü olan ülke yok,cnnturktekno
 Hangi otomobil markası hangi ülkeye ait İşte yanıtı,cnnturktekno
Cüce gezegen hakkında şaşırtan iddia Oldukça zengin olabilir,cnnturktekno
Kuzey Kutbu tarihinin en sıcak yılını geçirdi,cnnturktekno
 Kotasız internet tarifelerini açıkladılar İşte yeni internet fiyatları,cnnturktekno
Tarihin ilk uzay ülkesin Odin’in şehrinde neler oluyor Murat Erdör…,cnnturktekno
Yeni nesil yonga setleri karşı karşıya,cnnturktekno
EKG özelliği ile hayat kurtardı,cnnturktekno
Ashen K ekran görüntüleri,cnnturktekno
İşte ’in en iyi giriş segment akıllı telefonları,cnnturktekno
GM Pro vs iPhone Plus Fotoğraf karşılaştırması,cnnturktekno
iOS sorunlarla boğuşuyor,cnnturktekno
Pixel ailesi bir kez daha görüntülendi,cnnturktekno
Geliştirenler başarılı olacak Geleceğin yedi beceresi belirlendi,cnnturktekno
Meteor yağmuru geliyor Yılın son gök olayı için geri sayım başladı,cnnturktekno
 i hiç bir zaman unutmadık,cnnturktekno
Google açıkladı Planlanandan önce kapanıyor,cnnturktekno
Instagram kullanımında kaçıncı sıradayız,cnnturktekno
 Oyun oynamasını istemeyen karısını canlı yayında dövdü,cnnturktekno
Küçük ama etkili eria XZ4 Compact,cnnturktekno
Galaxy S10 ailesinin ekran boyutları sızdırıldı,cnnturktekno
TPLink Archer VR1200’e yakından bakıyoruz,cnnturktekno
Japonya da Çinli üreticilere cephe aldı,cnnturktekno
mCable HDMI kablo nedir Ne işe yarar,cnnturktekno
Microsoft yeni bir sürüm üzerinde çalışıyor,cnnturktekno
En ucuz amiral gemisi telefonlar,cnnturktekno
iPhone Max fiyatına yapılabilecek alternatifler,cnnturktekno
Apple Touch ID yöntemi ile insanları dolandırdılar,cnnturktekno
Qualcomm G’ye bel bağlamış,cnnturktekno
İşte TL altına alınabilecek en iyi akıllı telefonlar,cnnturktekno
Önümüzdeki on yılda G AI ve XR konuşulacak,cnnturktekno
Yandex Phoneun özellikleri neler,cnnturktekno
yılı amiral gemileri karşı karşıya Peki hangi telefon daha iyi,cnnturktekno
Nokia ’in tanıtım videosu sızdı,cnnturktekno
Super Smash Bros Ultimate rehberi,cnnturktekno
Google Allo’nun fişi çekildi,cnnturktekno
Pix çanta ezber bozuyor,cnnturktekno
 D yazıcı ile kişiye özel üretiliyor Türkiyenin ilk yerli şeffaf apareyine yeni yatırım,cnnturktekno
 Kayserili iki öğrencinin kodlamasını hazırladığı proje hayata geçti Bu Mama Benden hashtagiyle atılan her t…,cnnturktekno
 Social Media Effect sergisi sanatseverlerle buluştu,cnnturktekno
İşte en çok satan telefon markaları,cnnturktekno
Lise öğrencisi Appleın yeni bir güvenlik açığını buldu,cnnturktekno
 Yeni Dragon Age oyunu ne zaman çıkacak,cnnturktekno
 Resident Evil Remake için yeni videolar yayınlandı,cnnturktekno
 Türkçe dil seçeneğine sahip Nintendo Switch oyunları,cnnturktekno
Delikli ekrana sahip ilk telefon Huawei Nova,cnnturktekno
Galaxy A8 Star ile çekilmiş fotoğrafta hile yaptı,cnnturktekno
Çift ekranlı Vivo NEX,cnnturktekno
Steam’e dişli bir rakip geliyor,cnnturktekno
PlayStation Classic’e yakından bakıyoruz,cnnturktekno
En iyi iPhone duvar kağıtları,cnnturktekno
Bu yıl en çok onlar konuşuldu,cnnturktekno
WhatsApp kullananlar dikkat Artık bu telefonlarda çalışmayacak,cnnturktekno
İşte Mesh Teknolojisinin önemi Eğer kablosuz ağınız yeterince güçlü değilse,cnnturktekno
 Just Cause için nefes kesen çıkış videosu,cnnturktekno
 Control için K ekran görüntüler yayınlandı,cnnturktekno
PlayStation Classic zor olsa da hacklendi,cnnturktekno
ABD ordusu güvenlik açıklarını önlemeye kararlı,cnnturktekno
 Battlefield V güncellemesi ile gelen yenilikler,cnnturktekno
PlayStation Classic Türkiye’de satışta,cnnturktekno
’i Çin kökenli İşte en çok satan telefon markaları,cnnturktekno
 Apple açıkladı İşte in en iyi oyun ve uygulamaları,cnnturktekno
Google Play açıkladı İşte Türkiye için en iyi uygulama,cnnturktekno
Apple kullanıcılarına kötü haber Büyük zam yapıldı,cnnturktekno
Apple kullanıcılarına kötü haber Büyük zam yapıldı,cnnturktekno
WhatsApp bir ilke imza attı Tarihinde ilk kez televizyonda,cnnturktekno
Eğer bir kullanıcı sizi engellerse bu engelden kurtulmak istiyorsanız İşte WhatsAppın a…,cnnturktekno
Apple açıkladı İşte in en iyi oyun ve uygulamaları,cnnturktekno
 Spotify’ın verileri açıklandı Türkiyenin Enleri belli oldu,cnnturktekno
En iyi selfie çeken en ucuz telefonlar,cnnturktekno
Galaxy S10 nasıl olacak,cnnturktekno
GM Pro vs Apple iPhone Plus,cnnturktekno
Apple Watch için Super Smash Bros Ultimate temalı kadranlar,cnnturktekno
 Avustralyanın Melbourne kentinde çok nadir bir hayvan türü keşfedildi Altın sarısı fare Japon çizgi filmindeki Pikachu kar…,cnnturktekno
NASAdan nefes kesen kareler,cnnturktekno
BTKdan büyük veri ve siber güvenlik uyarısı,cnnturktekno
 İptal edilen PlayStation oyunları,cnnturktekno
Samsung’dan Harry Potter hamlesi,cnnturktekno
Apple Watch Series çok yakında EKG çekebilecek,cnnturktekno
En iyi Siri Kestirmeleri Tek tıklama ile iPhone’un sunmadığı özellikleri kullanmaya başlayabilirsiniz,cnnturktekno
Nubia Red Magic Mars özellikleri nasıl,cnnturktekno
Xiaomi Mi A2 Lite için beklenen güncelleme yayınlandı,cnnturktekno
Nokia Android Pie ile çalışırken görüntülendi,cnnturktekno
Zararlı yazılım sayısı milyon adete yükseldi,cnnturktekno
Google Translate tasarımı komple yenilendi,cnnturktekno
Türkiyede bugün satışa sunuldu İşte yeni iPhone fiyatları,cnnturktekno
Translate yenilendi İşte özellikleri,cnnturktekno
PlayStation sızdı mı,cnnturktekno
 ’a damga vuracak olan en iyi oyunlar,cnnturktekno
Galaxy S10 Plus özellikleri nasıl olacak,cnnturktekno
Fortnite FPS için iPhone gerekli,cnnturktekno
Galaxy Note için One UI Beta çıktı,cnnturktekno
 Pokémon Let’s Go Pikachu PC’de çalıştı,cnnturktekno
Nintendo Switch almak için sebep,cnnturktekno
Logitech C922 Pro’ya yakından bakıyoruz,cnnturktekno
Geri sayım başladı WhatsApptan kullanıcıları sinirlendirecek güncelleme İşte tepki çeken…,cnnturktekno
WhatsAppta yaprak dökümü sürüyor,cnnturktekno
 Nintendo Switch almak mantıklı mı,cnnturktekno
Huawei’den InfinityO hamlesi,cnnturktekno
Galaxy Note kamera sorunu yaşıyor,cnnturktekno
Google Chrome’a jestler geliyor,cnnturktekno
Samsung fabrikalarında kişi kansere yakalandı,cnnturktekno
Nokia ve Oppo el sıkıştı,cnnturktekno
 Oyun ve film karakterlerinden esinlenerek büyük bir titizlik ile hazırlanan birbirinden güzel çalışmalar,cnnturktekno
AB üyesi ülke Googleı şikayet edecek Konumu takip ediyor,cnnturktekno
bin lira altı en iyi akıllı telefonlar,cnnturktekno
En iyi selfie çeken en ucuz telefonlar,cnnturktekno
Windows H1 güncellemesi neler sunuyor,cnnturktekno
Galaxy F meraklıları hayrete düşürdü,cnnturktekno
 Grand Theft Auto Liberty City Stories PC’de,cnnturktekno
Huawei Mate Pro’ya yakından bakıyoruz,cnnturktekno
GM Pro vs Note  Fotoğraf karşılaştırması,cnnturktekno
milyon yolcunun verileri çalındı,cnnturktekno
Xbox One X’a özel SSD,cnnturktekno
VDSL ADSL Fiber ve kablolu bağlantılar bir arada,cnnturktekno
 The Legend of Zelda Skyward Sword Nintendo Switch’e gelebilir,cnnturktekno
kadından alınan embriyoların genetiği değiştirildi İlk genetik tasarım bebekler doğdu,cnnturktekno
Aylar sürdü ama en sonunda gerçek oldu NASA Marstan ilk görüntüyü paylaştı,cnnturktekno
WhatsAppa yeni bir özellik daha,cnnturktekno
Çocuklar internette kaç saat geçiriyor Esra Öz için yazdı,cnnturktekno
Ambalaj tasarımınızı kendiniz oluşturun,cnnturktekno
Red Hat dijital dönüşüme nasıl bakıyor,cnnturktekno
LG kameralı telefon üzerinde çalışmaya başladı,cnnturktekno
Huawei Mate Pro vs Google Pixel,cnnturktekno
Akıllı telefon bakımı nasıl yapılır,cnnturktekno
Dünya haritasında Rusya neden Afrikadan daha büyük görünür,cnnturktekno
Huawei Apple’dan çok telefon sattı,cnnturktekno
Battlefield V sanat çalışmaları,cnnturktekno
En ilginç PlayStation aksesuarları,cnnturktekno
Play Store’dan oyun kaldırıldı,cnnturktekno
Nokia Vega’nın özellikleri nasıl olacak,cnnturktekno
iPhone Türkiye fiyatı cep yakıyor,cnnturktekno
Windows nasıl sıfırlanır,cnnturktekno
Super Mario Odyssey’i Bit Mario ile oynayın,cnnturktekno
Motorola Moto Z4 özellikleri ile büyüleyecek,cnnturktekno
Xbox One’ı dik konumda kullanmayın,cnnturktekno
 Geleceğimizi inşa eden öğretmenlerimizin Öğretmenler Günü’nü kutlarız,cnnturktekno
Yeni iPhone’ların Türkiye fiyatı belli oldu,cnnturktekno
Epson EcoTank L7160 inceleme altında,cnnturktekno
İşte Instagram’ın yeni arayüzü,cnnturktekno
InfinityO nasıl görünecek İşte yanıtı,cnnturktekno
Özel tasarım tshirt tasarlamak artık çok kolay,cnnturktekno
Orta seviye Google Pixel yolda,cnnturktekno
Bixby  Galaxy F ile gelecek,cnnturktekno
Apple şimdi de gazilerin tıbbi verilerini toplayacak,cnnturktekno
Steam Link’in fişini çekti,cnnturktekno
Dünya çok korkutucu bir yerdi Sizce insanlığın yaşadığı en kötü yıl hangisiydi,cnnturktekno
Nintendo Switch artık kırılmıyor,cnnturktekno
LG Q9 özellikleri nasıl olacak,cnnturktekno
Instagram sahte takipçinin peşine düşecek,cnnturktekno
PlayStation ne zaman çıkacak,cnnturktekno
Honor Magic parçalarına ayrıldı,cnnturktekno
Yeni iPad Pro bilgisayarların yerini alacak,cnnturktekno
Apple Watch’u iPod’a dönüştürün,cnnturktekno
Fenerbahçe PUBG takımını duyurdu,cnnturktekno
Galaxy Note devasa bir ekranla gelecek,cnnturktekno
Siber suçlular Black Friday’e niçin odaklanıyor,cnnturktekno
Siber suçlular Black Friday’e niçin odaklanıyor,cnnturktekno
Yeni iPad Pro pek de sağlam çıkmadı,cnnturktekno
NASAdan Star Trek hayranlarını heyecanlandıran keşif,cnnturktekno
App Storedan sildi Appledan iPhonelar için WhatsApp kararı,cnnturktekno
Microsoft’tan disk sürücüsüz Xbox One,cnnturktekno
Güvenlik açığı bulundu Dikkat Instagram şifreniz çalınmış olabilir,cnnturktekno
Samsung Gear S3 muazzam bir indirime gitti,cnnturktekno
Sony E3 ’a katılmayacağını açıkladı,cnnturktekno
Xiaomi Mi A2 fiyatında kalıcı indirim,cnnturktekno
 NASAnın Uzay Fotoğrafçısı ve Görüntü Yönetmeni James Neihouse Türkiyeye geldi,cnnturktekno
Huawei Lite tanıtılmadan reklamı yayınlandı,cnnturktekno
Moto G7 bu sefer görselleri ile karşımıza çıktı,cnnturktekno
LG Q9 özellikleri belli oldu,cnnturktekno
NASA düğmeye bastı saatlik yolculuk saate iniyor,cnnturktekno
Kilogram devrimi Elektrikle ölçülecek,cnnturktekno
Hiç bilgisayar kullanmamıştı ama Siber güvenlik bakanı oldu,cnnturktekno
Ekranı yanmıyor kendi kendini tamir ediyor İşte dayanıklılık testi,cnnturktekno
Facebook yayınladı İlk kez IOSda,cnnturktekno
Kurucusu açıkladı Twitter baştan aşağıya değişebilir Popülarite savaşına dönüştü öne…,cnnturktekno
Komşu güneş sisteminde yeni bir gezegen,cnnturktekno
 RenaultNissanMitsubishi İttifakından lityum pil yatırımı,cnnturktekno
Google Netflixin gizli kodlarını açıklamış Yüzlerce film ve diziye ulaşmak mümkün,cnnturktekno
Netflix müjdeyi verdi Fiyatlar yarı yarıya düşecek,cnnturktekno
 Demirören Medya Hürriyet markasıyla internet basınında Avrupa açılımı yapıyor Almanca olarak okuyucuyla buluşacak olan …,cnnturktekno
