Tweet,Category
Milyonlar internette bu görüntüleri izliyor,cnnturktekno
WhatsAppa bomba özellik geliyor,cnnturktekno
Samsung Galaxy Tab S6 Türkiyeye geldi İşte özellikleri ve fiyatı,cnnturktekno
Samsung Note bombasını patlattı Fiyatı duyan şaşkınlık geçirdi,cnnturktekno
USA Todayın merkez binası silahlı saldırgan ihbarı sonrası tahliye edildi,cnnturktekno
Dünyanın yüzde sı internet kullanıyor,cnnturktekno
Samsungun yeni amiral gemisi bu akşam tanıtılıyor Note un benzersiz özellikleri ve fiyatı…,cnnturktekno
Dünyayı ayağa kaldıran uygulama Tehlike saçıyor,cnnturktekno
Huawei Mate Pro işte böyle görünüyor,cnnturktekno
Huawei Y9 Prime Türkiye’de satışa çıktı,cnnturktekno
Kontratlı telefon alanlar dikkat Kapanma riski var,cnnturktekno
Samsungun yeni akıllı saati tanıtıldı,cnnturktekno
Telefonunuzdan bu uygulamaları hemen kaldırın,cnnturktekno
Türkiyede satışa çıktı İşte fiyatı,cnnturktekno
Huawei tarih verdi İşte yeni işletim sistemi,cnnturktekno
İstanbulda uyuşturucu operasyonu şüpheli gözaltında,cnnturktekno
İşte dünyanın kaderini değiştiren buluşlar,cnnturktekno
WhatsApp ve Instagramda flaş yenilik,cnnturktekno
Lenovo ThinkBook s uyku modunda müzik çalıyor,cnnturktekno
YouTubeda yeni dönem İlk iPhone kullanıcıları yararlanacak,cnnturktekno
İşte yılında Instagrama yeni gelen özellikler,cnnturktekno
Kalemli iPhone dönemi başlıyor,cnnturktekno
Google uyardı Telefonunuzda yüklüyse hemen silin,cnnturktekno
Samsungun katlanabilir amiral gemisinin çıkış tarihi belli oldu,cnnturktekno
Google bu sabah duyurdu Listede sizinki de olabilir,cnnturktekno
Huawei Mate Pronun özellikleri,cnnturktekno
İlk kez yapıldı Artık zihninizi okuyacak,cnnturktekno
Bugünden itibaren bedava Telefonunuza hemen indirin,cnnturktekno
Telefonunuz kapansa da WhatsAppı kullanabileceksiniz,cnnturktekno
Facebooka yeni özellik geliyor,cnnturktekno
Instagramın gizli planı ortaya çıktı,cnnturktekno
yeni iPhone geliyor Appledan bir ilk,cnnturktekno
Huawei Y9 Prime satışa çıkıyor İşte özellikleri,cnnturktekno
WhatsApp kullanıcılarına müjde,cnnturktekno
Cep telefonu ile konuşurken kulaklık kullanıyorsanız dikkat,cnnturktekno
Çocukların bulunduğu YouTube videoları daha fazla izleniyor,cnnturktekno
iPhone gün sayıyor İşte özellikleri,cnnturktekno
İşte Dünyayı bekleyen kaçınılmaz tehlike,cnnturktekno
iPhone artık vazgeçilmez değil,cnnturktekno
Merdivene tırmanan robot görenleri şaşırttı,cnnturktekno
Googledan internet tüketimini azaltan fotoğraf uygulaması,cnnturktekno
Twitterdaki retweet butonunun mucidi Dört yaşındaki bir çocuğun eline dolu bir silahı verdik…,cnnturktekno
İşte en çok radyasyon yayan akıllı telefonlar,cnnturktekno
Facebook milyar dolar ceza ödeyecek,cnnturktekno
Instagrama yeni özellik Tepki çekti,cnnturktekno
Çoğu kişi bilmiyor Uçağa bindiğinizde şaşırtacak detaylar,cnnturktekno
Dünyanın en çok satan iPhone modeli belli oldu,cnnturktekno
Direksiyonlar değişiyor İşte otomobillerin yeni yüzü,cnnturktekno
Eski telefon deyip geçmeyin Öyle bir şeye dönüştürdü ki,cnnturktekno
Facebooktaki bu işarete dikkat Hayatlarını değiştirdi,cnnturktekno
Samsungun yeni amiral gemisine sayılı gün kaldı Note un fiyatı ve teknik özellikleri belli oldu…,cnnturktekno
iPhonelarda bu sabahtan itibaren yeni dönem başladı,cnnturktekno
Uygun fiyata cep telefonu satın alma tüyoları,cnnturktekno
Appleın yeni sürprizi ortaya çıktı,cnnturktekno
iPhone artık vazgeçilmez değil,cnnturktekno
WhatsAppta güvenlik açığı Milyonlarca kullanıcıyı ilgilendiriyor,cnnturktekno
O sahnelerin gerçek hali şaşkına çeviriyor,cnnturktekno
Sosyal medyanın yeni trendi güvenilir mi Silin başvurusu yağıyor,cnnturktekno
Kullanıcılar şokta Instagramda bir dönem sona eriyor,cnnturktekno
Twitterın tasarımı değişiyor,cnnturktekno
YouTubea telefondan girenler dikkat Resmen başladı,cnnturktekno
Samsung Galaxy Note geliyor Kulaklığı böyle olacak,cnnturktekno
İşte telefonlara gelen en yeni emojiler,cnnturktekno
NASAnın Kızıl Gezegendeki göz bebeği böyle görüntülendi,cnnturktekno
Gizli özellik ortaya çıktı Uzun süre bu tuşa basılı tutarsanız,cnnturktekno
Huawei Mate Pro nasıl olacak İşte özellikleri,cnnturktekno
WhatsAppta yeni dönem Resmen başlıyor,cnnturktekno
Dikkat Bir defaya mahsus af çıkıyor,cnnturktekno
Facebooka milyar dolarlık ceza kapıda,cnnturktekno
İşte çocukların korkulu rüyası Momonun son hali,cnnturktekno
Microsoft şifresiz oturum açma peşinde,cnnturktekno
Apple Watch uygulamasında güvenlik açığı çıktı kapatıldı,cnnturktekno
Japonların yeni buluşu şaşkınlık yarattı,cnnturktekno
Telefonunuzda bu ayar açıksa hemen kapatın,cnnturktekno
Note tanıtıldı İşte özellikleri ve fiyatı,cnnturktekno
Twitter dini gruplara yönelik hakaretleri yasaklıyor Uymayanların hesapları dondurulacak,cnnturktekno
İşte en çok radyasyon yayan akıllı telefon modelleri,cnnturktekno
Öğrenince çok şaşıracağınız ilginç teknolojik ipuçları,cnnturktekno
Google yayınladı İşte ten bugüne İstanbul,cnnturktekno
Appleın kurucularından Steve Wozniak çağrı yaptı Facebooku silin,cnnturktekno
Instagramdan kullanıcıları sevindirecek yenilik Engellenecek,cnnturktekno
G ile hayatımızda neler değişecek,cnnturktekno
İşte iPhone  Yeni görüntüleri internete sızdı,cnnturktekno
Google’dan mobile telefon operatörü hamlesi,cnnturktekno
Huawei kendi işletim sistemini gelecek ay tanıtılabilir,cnnturktekno
Sonyden katlanabilen telefon atağı,cnnturktekno
Bomba özelliklerle geliyor Bakışlarınızın bile sahtesini yapacak,cnnturktekno
Bilgisayarları bekleyen yeni büyük tehlike,cnnturktekno
Whatsappın yeni özelliği milyonları sevindirdi,cnnturktekno
Appleın yeni bombası iPhone XI İşte fiyatı ve özellikleri,cnnturktekno
Bu siteye sakın girmeyin Google bile erişim sağlamıyor,cnnturktekno
iPhonelarda yeni dönem başlıyor,cnnturktekno
Microsoft büyük umutlar bağlamıştı ama tutmadı kapatılıyor,cnnturktekno
Milyonlar bu görüntülere kilitlendi Şişe kapağını siyaha boyayıp,cnnturktekno
Samsung Galaxy Note büyük bir sürprizle geliyor,cnnturktekno
Telefonların fiyatları düşürüldü İşte marka marka o liste,cnnturktekno
Bu uygulamaları sakın indirmeyin,cnnturktekno
Öğrenince yok artık diyeceğiniz çılgın buluşlar,cnnturktekno
WhatsAppla ilgili çok önemli uyarı,cnnturktekno
Huawei P30 serisi milyon satış barajını geçti,cnnturktekno
Almanyadan Facebooka milyon avro ceza,cnnturktekno
Bomba özellik içinde gizli Bu tuşa uzun süre basarsanız,cnnturktekno
Samsung açıkladı Yeni amiral gemisi Galaxy Note geliyor,cnnturktekno
 ABD ile Çin arasındaki savaşta yeni cephe Ay,cnnturktekno
Bu epostaları sakın açmayın,cnnturktekno
yılının en iyi akıllı telefonu seçildi,cnnturktekno
Milyonlarca telefon değişiyor Listede sizinki de olabilir,cnnturktekno
Samsung telefonlar artık böyle şarj olacak,cnnturktekno
Google Mesajlar uygulaması için AR filtreleri kullanılabilecek,cnnturktekno
Telefonlar havadan şarj olacak,cnnturktekno
Xiaomi sürpriz bir telefonla geliyor Mi CC9,cnnturktekno
Apple duyurdu Arızalı çıktı bedava değiştirecek,cnnturktekno
Twitter açıkladı Uyarı etiketi geliyor,cnnturktekno
WhatsApp hikayeleri Facebook ve Instagrama geliyor,cnnturktekno
Huawei telefon sahiplerine önemli uyarı Ücretsiz hizmet başlıyor,cnnturktekno
Microsofttan Intele büyük şok Yollar ayrılıyor mu,cnnturktekno
un en çok indirilen uygulamaları belli oldu,cnnturktekno
En çok indirilen uygulamalar belli oldu,cnnturktekno
WhatsAppın gizli özelliği ortaya çıktı,cnnturktekno
Telefonunuzda yüklüyse hemen silin,cnnturktekno
iPhoneun tasarımcısı Jony Ive Appledan ayrılıyor,cnnturktekno
Telefonlar baştan sonra değişti Hemen şimdi kontrol edin,cnnturktekno
Sosyal medyadaki büyük tehlike İntihara sürüklüyor,cnnturktekno
WeTransfer bir skandala imza attı,cnnturktekno
Telefonunuzun şarjı çabuk bitiyorsa bunları mutlaka yapın,cnnturktekno
İşte Türkiyedeki en popüler akıllı telefonlar,cnnturktekno
Xiaomi CC geliyor İşte öne çıkan özellikleri,cnnturktekno
Telefonunuzdaki o ayarı hemen değiştirin Biri aradığında artık,cnnturktekno
Belgeselden etkilenip başladı şimdi siparişlere yetişemiyor,cnnturktekno
Google Takvim uygulamasından gelen büyük tehlike,cnnturktekno
Telefonunuz suya düşerse kurtarmak için bu yolları izleyebilirsiniz,cnnturktekno
Telefonunuzda yüklüyse silin Ekranınızda yaptığınız her şeyi kaydediyor,cnnturktekno
Huawei sahiplerine önemli uyarı Telefonlar değişiyor,cnnturktekno
kişiden ’sı aynı parolayı kullanıyor,cnnturktekno
Telefonunuzdaki gizli özellik O ayarı yaparsanız,cnnturktekno
iOS güncellemesinin yüklenebileceği telefonlar,cnnturktekno
Instagrama bomba özellikler geliyor,cnnturktekno
Samsung Galaxy Fit ve Galaxy Fit e Türkiyede satışa çıktı,cnnturktekno
dakikada şarj olabilen telefon,cnnturktekno
Rus mühendis yaptı son haline şaşıracaksınız,cnnturktekno
iOS geliştiricileri Android geliştiricilerden çok kazanıyor,cnnturktekno
İşte Android Pie güncellemesi alacak modellerin tam listesi,cnnturktekno
Googledan flaş karar Tablet üretimini sona erdiriyor,cnnturktekno
Netflix üyelik ücretlerine zam geldi İşte yeni fiyatlar,cnnturktekno
WhatsApptan milyonları sevindiren hamle,cnnturktekno
iPhonelarda bir dönem kapanıyor İşte iOS le gelecek olan yenilikler,cnnturktekno
OPPO Reno x Zoom Türkiyede satışa çıktı İşte fiyatı,cnnturktekno
Astronotların maaşı dudak uçuklattı,cnnturktekno
Twitterdan flaş hamle O özelliği kaldırıyor,cnnturktekno
Görürseniz şaşırmayın Uçağa binmeden önce artık,cnnturktekno
iPhonelarda bir dönem sona eriyor,cnnturktekno
Telefonlar değişiyor Listede sizinki de olabilir,cnnturktekno
Samsung Galaxy Note için gece modu aktif oldu,cnnturktekno
Bazı iPhone modellerine gece modu hiç gelmeyecek,cnnturktekno
Pet şişenin kapağını kesip öyle bir şey yaptı ki,cnnturktekno
Bu uygulamalar tehlike saçıyor,cnnturktekno
Huawei Mate Pro özellikleri belli oldu,cnnturktekno
İşte Samsung Galaxy A70 incelemesi,cnnturktekno
iPhoneda bu tuşa uzun süre basarsanız,cnnturktekno
PUBG Mobilea yeni mod Ölüm Maçı,cnnturktekno
iPhoneda bir dönemin sonu iOS teki detay ortaya çıktı,cnnturktekno
İşte en ucuz cep telefonları,cnnturktekno
Şaşırtan buluşlar Hepsi birbirinden ilginç,cnnturktekno
Akıllı telefonlardaki bu gizli özelliği çok az kişi biliyor,cnnturktekno
Google müjdeyi verdi O özellik geliyor,cnnturktekno
Uluslararası Uzay İstasyonuna gidişdönüş ücreti belli oldu,cnnturktekno
Huawei P30a yeni özellik,cnnturktekno
Akıllı telefonlardaki bu gizli özelliği çok az kişi biliyor,cnnturktekno
Bugünden itibaren herkese bedava,cnnturktekno
WhatsApptan kullanıcılarına kötü haber,cnnturktekno
Facebook ödeme karşılığı kullanıcıları izleyecek,cnnturktekno
İşte karşınızda Huawei Mate Pro En önemli özelliği,cnnturktekno
Facebookta bunu yapan yandı,cnnturktekno
Tüm dünya ilgiyle izledi ama o sahnelerin hepsi yalan İşte gerçek halleri,cnnturktekno
dolara telefon İnternete girmeyen kalmayacak,cnnturktekno
Instagramda şifre şoku Şifrelenmeden saklanıyor,cnnturktekno
Telefonlarda bir dönemin sonu Resmen kaldırılıyor,cnnturktekno
WhatsAppa iki yeni özellik geliyor,cnnturktekno
Instagram kullanıcılarına müjde verildi Artık daha az kullanılacak,cnnturktekno
Telefonunuzun ismini kontrol edin Büyük değişim bugün başlıyor,cnnturktekno
Huaweiye bir kötü haber daha Facebook WhatsApp ve Instagram yüklenemeyecek,cnnturktekno
Instagram kullanıcılarına önemli uyarı,cnnturktekno
Huawei Çinin telekom devi Rusyada G teknolojisini geliştirecek,cnnturktekno
WhatsApp iPhone uygulamasına iki yeni özellik geldi,cnnturktekno
WhatsApp’ta dönem dönem meydana gelen iletim sorunu bugün yine yaşandı,cnnturktekno
WhatsApptan devrim gibi yenilik,cnnturktekno
iTunes adım adım yolun sonuna geliyor,cnnturktekno
iOS tanıtıldı Hangi telefonlara gelecek,cnnturktekno
iPhoneda bu tuşa uzun süre basarsanız,cnnturktekno
iPhone MB indirme sınırı kaldırıldı,cnnturktekno
Apple Google Microsofttan İngiliz istihbaratına ret,cnnturktekno
İnanılmaz görüntü Plastik şişeye ütü basıp,cnnturktekno
Facebook kullananlara müjde O özellik geliyor,cnnturktekno
Google geri adım attı Huawei Mate Pro listeye girdi,cnnturktekno
Googledan milyonlara çok önemli uyarı,cnnturktekno
WhatsAppa iki yeni bomba özellik,cnnturktekno
iOS nasıl görünüyor İlk ekran görüntüleri ortaya çıktı,cnnturktekno
Telefonların batarya süresini uzatmak mümkün İşte yapmanız gerekenler,cnnturktekno
Telefonunuzdaki sinsi tehlike Hemen yok edin,cnnturktekno
Kozmonotlar uzay boşluğunda senedir yüzen havluyu aldı,cnnturktekno
Appledan yeni bir iPhone daha,cnnturktekno
Lise öğrencisi Instagramda paylaştı milyonlar izledi Şişe kapağını siyaha boyayıp,cnnturktekno
Yeni nesil uykuda oyun dönemi Uyudukça ödüllendirileceksiniz,cnnturktekno
Çin ordusu bilgisayarlarından Windows’u kaldırıyor,cnnturktekno
Whatsapptan kullanıcıları kızdıracak karar Çok tartışılan özellik için tarih verildi,cnnturktekno
ABDnin Huawei ambargosu bu telefonları kapsamayacak,cnnturktekno
O telefonlar baştan sona değişiyor Listede sizinki de olabilir,cnnturktekno
Telefonların en tehlikeli uygulamaları Hemen kaldırın,cnnturktekno
Tarihin en hızlı uçağı için düğmeye bastı,cnnturktekno
Huawei P30 Lite Türkiyede İşte fiyatı ve özellikleri,cnnturktekno
dakikada tükenmez kalemden öyle bir şey yaptı ki,cnnturktekno
NASA canavara karşı uyardı Sık sık gerçekleşebilir,cnnturktekno
Snapchat uygulamasında casus şoku,cnnturktekno
Milyonlarca Instagram kullanıcısına şifre şoku,cnnturktekno
 Çinli tüketiciler Appleı bırakıp Huawei alıyor,cnnturktekno
WhatsApptan iki yeni özellik Bu yenilikler hayatınızı kolaylaştıracak,cnnturktekno
Xiaomi Redmi A tanıtıldı İşte özellikleri,cnnturktekno
İşte dünyanın en iyi Android telefonları,cnnturktekno
WhatsApptan kullanıcılarını kızdıracak adım,cnnturktekno
NASA yardımınızı istiyor Gönüllü arıyorlar,cnnturktekno
Facebooktan yeni uygulama Verileri daha fazla kontrol etme imkanı geliyor,cnnturktekno
Googledan hata açıklaması,cnnturktekno
Telefonunuzdaki gizli özellik Kimse farkında bile değil,cnnturktekno
YouTubedan yeni uygulama,cnnturktekno
WhatsAppta yeni dönem Resmen başladı,cnnturktekno
Google uyarıyor Telefonunuzdan hemen silin,cnnturktekno
Instagram fenomenlerinin özel iletişim bilgileri açığa çıktı,cnnturktekno
Telefonunuzu satışa çıkarmadan önce dikkat etmeniz gerekenler,cnnturktekno
Facebookta büyük kriz Artık kimse istemiyor,cnnturktekno
Google’dan Huawei’ye güncelleme yasağı,cnnturktekno
Siber saldırganların akılalmaz oyunu WhatsApp nasıl hacklendi,cnnturktekno
Uçak yolculuğu yapacaklar dikkat Telefonlar uçuş moduna geçtiği an,cnnturktekno
Siber saldırganlar iş arayanları hedef alıyor,cnnturktekno
TikTok beşinci defa zirvede,cnnturktekno
Facebook bombayı patlattı O özelliği geri getiriyor,cnnturktekno
Dokuzuncu gezegende sıra dışı bahar,cnnturktekno
Xiaomi Mi SE Türkiyede satışa çıkıyor İşte fiyatı,cnnturktekno
▪ Beyni büyük olanlar daha mı zeki ▪ Kaç tane burun deliğimiz var ▪ Evren ne renktir İşte az kişi tarafından…,cnnturktekno
Instagram o uygulamanın fişini çekiyor,cnnturktekno
WhatsAppa bomba özellik İşte ilk görüntü,cnnturktekno
Facebook duyurdu Yasaklanıyor,cnnturktekno
WhatsApp saldırısı sonrası güvenlik için bunları yapın,cnnturktekno
WhatsApptaki büyük tehlike Casus yazılım hedef aldı,cnnturktekno
iOS güncellemesi yayınlandı,cnnturktekno
Whatsapp kullanıcılarına kötü haber geldi Bazı modellerde artık çalışmayacak,cnnturktekno
Instagramdan Ramazan ayına özel kamera efektleri,cnnturktekno
Honor ve Honor Pro geliyor,cnnturktekno
Yeni iPhonedan bir detay daha ortaya çıktı İşte o özellik,cnnturktekno
Google uyarıyor Telefonunuzdan hemen silin,cnnturktekno
Akıllı telefon alırken dikkat edilmesi gerekenler,cnnturktekno
Dünyayı şaşkına çeviren böceğin inanılmaz özelliği,cnnturktekno
Google yapay zeka ile akciğer kanserini erken teşhis edebilecek,cnnturktekno
WhatsApptan sürpriz hamle O telefonlara geri dönüyor,cnnturktekno
Birçok kişi bilmiyor Gizli özelliği ortaya çıktı,cnnturktekno
İşte TL altı akıllı telefonlar,cnnturktekno
WhatsApptan mobil ödeme hizmeti,cnnturktekno
iOS ün özellikleri sızdı Apple o iPhoneların fişini çekiyor,cnnturktekno
İşte TL altına alınabilecek en iyi akıllı telefonlar,cnnturktekno
Samsung Galaxy Note un sürpriz özelliği ortaya çıktı,cnnturktekno
Mayıs ayında TL altı alınabilecek akıllı telefonlar,cnnturktekno
YouTube değişiyor,cnnturktekno
İşte en ucuz akıllı telefonlar,cnnturktekno
WhatsApptan tepki çeken adım Beklenen özellik ortadan kayboldu,cnnturktekno
Akıllı telefon alacaklar dikkat Özellikleri ve fiyatları şaşırtıyor,cnnturktekno
İşte en hızlı interneti sunan telefonlar,cnnturktekno
Dikkat Uçuşlarda yeni dönem saatlik uçuş süresi dakikaya inecek,cnnturktekno
WhatsApp Instagram ve Facebook çöktü mü,cnnturktekno
ÖTV yükseldi İşte yeni cep telefonu fiyatları,cnnturktekno
Instagramın yeni hali ortalığı karıştıracak Resmen kaldırılıyor,cnnturktekno
Şifre skandallarından sonra Facebooktan flaş hamle,cnnturktekno
Fiyatlar artacak mı İşte en ucuz akıllı telefonlar,cnnturktekno
WhatsAppın gizli özelliği ortaya çıktı Mesaj atmak için artık ona gerek kalmadı,cnnturktekno
Motorola’nın katlanabilir telefonu Razr sızdı,cnnturktekno
Oppo Reno ve Huawei P30 Pro kameraları karşı karşıya,cnnturktekno
Instagramdaki o sır ortaya çıktı Kullanıcılar merak ediyordu,cnnturktekno
Amazon Spotify’a rakip oluyor,cnnturktekno
Fişe takmadan önce şarj kablonuza bunu yapın Büyük bir sorundan kurtulacaksınız,cnnturktekno
Yeni iPhone XR çift kamerayla ortaya çıktı,cnnturktekno
Fişe takmadan önce şarj kablonuza bunu yapın,cnnturktekno
Samsung Galaxy S10 Plus için sürpriz güncelleme yayında,cnnturktekno
Huawei P30 Pro değişiyor,cnnturktekno
Samsung Galaxy A70 Türkiyeye geldi,cnnturktekno
Tutmaz denildi milyonu devirdi,cnnturktekno
Honor S satışa çıkıyor Fiyatı şaşırttı,cnnturktekno
Lenovo Z6 Pro daha ilk günden yoğun ilgi gördü,cnnturktekno
Doktor saatler,cnnturktekno
Black Shark sağlamlığıyla fark yaratacak,cnnturktekno
Nokia ’un ilk çeyreğinde milyon euro zarar etti,cnnturktekno
Nintendo’nun hibrit konsolu Switch ne kadar sattı,cnnturktekno
Avengers Endgame korsana yenik düştü,cnnturktekno
Fortnite için Avengers Endgame teması geldi,cnnturktekno
Telefonunuzdaki bu WiFi ayarını mutlaka değiştirin,cnnturktekno
OPPO yeni Reno serisini tanıttı,cnnturktekno
Facebooka büyük şok Ağır para cezası geliyor,cnnturktekno
Fiyatlarda büyük düşüş İşte indirime giren telefonlar,cnnturktekno
Google yeni güncellemesini kullanıcılarla paylaştı,cnnturktekno
WhatsApptan çok konuşulacak yasak,cnnturktekno
Galaxy Note için iştah kabartan konsept,cnnturktekno
PlayStation fiyatı açıklandı,cnnturktekno
HTC uzun bir aradan sonra Gli telefonuyla geliyor,cnnturktekno
Game of Thrones  Sezon  Bölüm korsana yenik düştü,cnnturktekno
iPhone in tasarımı ortaya çıktı Bomba özelliklerle geliyor,cnnturktekno
Oyun bilgisayarı toplayacaklar dikkat,cnnturktekno
Gmail kullananlara kötü haber,cnnturktekno
iPhone kullanıcılarına çok önemli uyarı,cnnturktekno
MP’lik telefon ile çekilen fotoğraflar,cnnturktekno
Instagram sürpriz bir özellikle kullanıcılarının karşısına çıkmaya hazırlanıyor,cnnturktekno
Kullanıcılara dikkat O telefonlar değişiyor,cnnturktekno
Huawei P30 Pro artık iPhoneların özelliğini kullanacak,cnnturktekno
Teknoloji devi 5 saniyede bir telefon üretiyor,cnnturktekno
Google Play için çok önemli güncelleme,cnnturktekno
Hızlı şarj özelliği ve inceliği ile fark yaratıyor,cnnturktekno
eria için yeni bir tanıtım videosu yayınladı,cnnturktekno
Galaxy Fold kafaların karışmasına neden oldu,cnnturktekno
Google Avrupada arama ve tarayıcı seçenekleri sunacak,cnnturktekno
Şifre skandalı Instagrama sıçradı Hesabınız tehlikede olabilir,cnnturktekno
Appleın son bombası İşte yeni iPhone modelinin özellikleri ve fiyatı,cnnturktekno
Bu listeyi kontrol edin İçinde sizin telefonunuz da olabilir,cnnturktekno
Facebook milyon kullanıcının mail adresini yanlışlıkla yükledi,cnnturktekno
Telefonunuzdaki gizli özellik Öğrenince çok şaşıracaksınız,cnnturktekno
WhatsApptan gelen gizli tehlike Sakın bunu yapmayın,cnnturktekno
 Kara delik görüntüsünün arkasında bir Türk kadını Feryal Özel,cnnturktekno
Bomba özellik içinde gizli Telefonunuzdaki bu tuşa uzun süre basarsanız,cnnturktekno
 Kara delik görüntüsünün arkasında bir Türk kadın Prof Dr Feryal Özel,cnnturktekno
iPhone sahiplerine önemli uyarı,cnnturktekno
Game of Thrones duvar kağıtları,cnnturktekno
iPhone kullanıcıları dikkat Beklenen özellik geliyor,cnnturktekno
Telefonunuzda bu uygulamalar yüklüyse başınız dertte Hemen silin,cnnturktekno
Honorun orta segmentteki yeni modeli ortaya çıktı,cnnturktekno
Outlook hesaplarında güvenlik sorunu ortaya çıktı,cnnturktekno
Huawei P30 Pro tamiri çok zor cihazlar listesine girdi,cnnturktekno
WhatsApp dünya genelinde çöktü,cnnturktekno
Samsung Galaxy M40 için geri sayım başladı,cnnturktekno
Gelmiş geçmiş en çılgın buluşlar,cnnturktekno
Ekranı dikey katlanan telefon İlk görüntüler paylaşıldı,cnnturktekno
 Teknoloji Her Yerde bu hafta şehirleri keşfetmemizi sağlayan yeni nesil çözümleri araştırıyor Akıllı telefon uygulamal…,cnnturktekno
Oppo F11 Pro fotoğraf performansıyla göz kamaştırıyor,cnnturktekno
LGden hem şeffaf hem ekranı katlanabilen telefon,cnnturktekno
WhatsApptan çok konuşulacak yeni özellik,cnnturktekno
Google bile erişim sağlayamıyor Sakın bu siteye girmeyin,cnnturktekno
Huawei Y5 geliyor İşte özellikleri ve fiyatı,cnnturktekno
Twitterda yeni dönem başlıyor,cnnturktekno
Facebook hesabını donduranlara önemli uyarı,cnnturktekno
WhatsApp yıllar sonra iPadlere geliyor,cnnturktekno
Eski telefon deyip atmayın Çok işe yarıyor,cnnturktekno
Attığınız USB belleklere dikkat,cnnturktekno
Samsung telefonlar için önemli güncelleme,cnnturktekno
LG yeni nesil ürünlerini tanıttı,cnnturktekno
Instagram ve Facebooktan sonra Microsoft da kaldırıyor,cnnturktekno
Facebooktaki büyük tuzağa dikkat Dolandırıcıların kredi kartı oyunu,cnnturktekno
Nokia Plus Türkiyede satışta İşte fiyatı,cnnturktekno
İşte Mart ayının yüksek performanslı akıllı telefonu,cnnturktekno
Apple o uygulamanın fişini çekiyor,cnnturktekno
Yeni trend akıllı telefonlar,cnnturktekno
Huaweiden hızlı şarj atağı,cnnturktekno
TL altında fiyata alınabilecek akıllı telefon,cnnturktekno
İşte piyasadaki en ucuz akıllı telefonlar,cnnturktekno
Samsung Galaxy A90 bu özelliklerle geliyor,cnnturktekno
Netflix abonelerine kötü haber,cnnturktekno
 Parmak iziyle çalışacak yeni akıllı araçlar geliyor,cnnturktekno
 Appleın en küçük telefonu geliyor iPhone XE,cnnturktekno
iPad Mini sağlamlık testinde,cnnturktekno
Galaxy A90 şimdi de videoda ortaya çıktı,cnnturktekno
Netflix Mobil Türkiyede kullanıma sunuldu Fiyatı da belli oldu,cnnturktekno
Dört kameralı Motorola böyle görünecek,cnnturktekno
Xbox Türkiye oyun fiyatlarını yükseltti,cnnturktekno
Dünyanın ilk G kullanan telefonu  Motorola Z3,cnnturktekno
PlayStation bu yıl satışa sunulabilir,cnnturktekno
WhatsApp grup sohbetleri için değişikliğe gittiğini açıkladı,cnnturktekno
Snapchate yepyeni özellik ,cnnturktekno
Türkiye genelinde telefon fiyatları yine düştü İşte yeni fiyatlar,cnnturktekno
Redmi Note satış rakamları belli oldu,cnnturktekno
Dikkat Netflix fiyatları değişiyor,cnnturktekno
WhatsAppta kullanıcıları şaşırtan hata,cnnturktekno
Instagram o uygulamayı kapatıyor,cnnturktekno
Kapış kapış gidiyor Dünyanın en çok satan Android telefonları,cnnturktekno
Bir skandal daha Facebooktaki milyonlarca kayıt Amazonun sunucularında,cnnturktekno
İşte Honor inin en dikkat çeken özelliği,cnnturktekno
Google o uygulamaların fişini çekiyor,cnnturktekno
Dünyanın en çok satan kablosuz kulaklıkları belli oldu,cnnturktekno
İşte üç kameralı Nokia X71,cnnturktekno
Huawei P30 Pro için hatalı dokunma açıklaması,cnnturktekno
iPhone in en dikkat çeken özelliği,cnnturktekno
Android telefonlara önemli güvenlik güncellemesi,cnnturktekno
Piyasanın en iyi kamerası onda,cnnturktekno
Apple Tesla yöneticilerini işe alıyor,cnnturktekno
Xiaomi Mi satış rakamları açıklandı,cnnturktekno
Facebook herkesin merak ettiği sırrı açıklayacak,cnnturktekno
 Apple TV için Samsung akıllı TVlere ihtiyacınız olabilir,cnnturktekno
 Henüz yaşında Günde saat oyun oynayarak bin dolar kazanıyor,cnnturktekno
